,#1 String,#2 String
3084,"Soon thereafter , Hahn debuted with the Philadelphia Orchestra , Cleveland Orchestra , Pittsburgh Symphony Orchestra , and the New York Philharmonic .",She debuted with the Chicago Symphony Orchestra in March of 2007 .
3085,The Province of Vicenza ( ) is a province in the Veneto region of northern Italy . Its capital city is Vicenza .,Vicenza is a province in the region of Veneto in Italy .
3086,Types of ceramic material .,Types of ceramic materials .
3087,"Water Lilies ( or Nymphéas , ) is a series of approximately 250 oil paintings by French Impressionist Claude Monet ( 1840 -- 1926 ) .","Water Lilies ( or Nymphéas , ] ) is a series of about 250 oil paintings by French Impressionist Claude Monet ."
3088,"( born October 26 , 1973 ) , better known by his ring name Taka Michinoku , is a professional wrestler who has wrestled all over the world as well he was a former mixed martial artist .","Takao Yoshida ( born October 26 , 1973 ) is a Japanese professional wrestler and former mixed martial artist who is currently working for New Japan Pro Wrestling under the ring name , Taka Michinoku ."
3089,"Lake and Sussman separated in August 2003 , and divorced in 2005 .",They separated in August 2003 . Lake and Sussman divorced in 2005 .
3090,"The average player will generally have a repertoire of around ten pieces which they will aim to play very well , learning new pieces as and when they feel like it or if the opportunity arises .","The average player can generally play around ten pieces from memory which they will aim to play very well , learning new pieces as and when they feel like it ."
3091,"On January 25 , 2007 , Reich was named 2007 recipient of the Polar Music Prize with jazz saxophonist Sonny Rollins .","On January 25 , 2007 , Reich was named the 2007 recipient of the Polar Music Prize , together with jazz saxophonist Sonny Rollins ."
3092,About three-fifths of the land area is a gentle plain with a general descent towards the Mississippi River and the Gulf of Mexico .,About three-fifths of the land area is a plain with a general downward slope towards the Mississippi River and the Gulf of Mexico .
3093,Professional racing is governed by the Union Cycliste Internationale .,Professional racing is controlled by the Union Cycliste Internationale ( UCI ) .
3094,"The services terminate in San Francisco , Washington , D.C. , New York City , Indianapolis , New Orleans , Portland , Seattle , Milwaukee , Quincy , St. Louis , Carbondale , Boston , Grand Rapids , Port Huron , Pontiac , Los Angeles , and San Antonio .","The services terminate in San Francisco , Washington , D.C. , New York City , Indianapolis , New Oreleans , Portland , Seattle , Milwaukee , Quincy , St. Louis , Carbondale , Boston , Grand Rapids , Port Huron , Pontiac , Los Angeles , and San Antonio ."
3095,Founding of Rome .,The Founding of Rome .
3096,"The name of the municipality stems from the Augustinian monastery Crucelin , later Kreuzlingen Abbey .","The name of the municipality stems from the Augustinian monastery Crucelin , which was later renamed Kreuzlingen Abbey ."
3097,"The site of the city of Meroë is marked by more than two hundred pyramids in three groups , of which many are in ruins .",The site of the city of Meroë is marked by over two hundred pyramids in three groups .
3098,A film 's success often depends on the quality of such musical numbers .,"Often , the success of a movie depends on the quality of these musical numbers ."
3099,"Press reports indicated in 2006 that skilled carpenters at the site earned # 4.34 a day , and labourers earned # 2.84 .","Press reports said in 2006 that skilled carpenters at the site earned UK # 4.34 a day , and labourers earned UK # 2.84 ."
3100,The single charted at number two on the UK Singles Charts .,The album charted at number two in the UK .
3101,The name of the town means `` the valley of canes '' in the Armenian language .,The name of the city means `` the valley of canes '' in the Armenian language .
3102,"In the early hours of 15 June 2003 , Sadler fell 40 feet ( 12 metres ) from the balcony of the Holland Park flat of her boyfriend and Holby City co-star George Calil .","In the early hours of 15 June 2003 , she fell 40 feet ( 12 metres ) from the balcony of the Holland Park flat of her boyfriend and Holby City co-star George Calil after having taken alcohol and cocaine ."
3103,"When Mandaue was a second class municipality in 1964 its population was 33,811 .","When Mandaue was a second class municipality in 1964 she had a population of 33,811 ."
3104,"In Japanese , haiku are traditionally printed in a single vertical line while haiku in English often appear in three lines to parallel the three phrases of Japanese haiku .","Japanese haiku are normally written in one line , while English language haiku are traditionally separated into three lines ."
3105,The Fleece officially reopened - with a new roof and improved facilities - on 18 June 2005 .,The Fleece officially reopened on 18 June 2005 with a new roof and other upgrades .
3106,"was a full-length edition of the Australian newsreel , Cinesound Review , produced by the Australian News & Information Bureau and Cinesound Productions Limited in 1942 .",was a full-length edition of the Australian newsreel . It was produced by the Australian News & Information Bureau and Cinesound Productions Limited in 1942 .
3107,"The entire 1,230-game schedule , that was to begin in October , was officially canceled on February 16 , 2005 due to an unresolved lockout that began on September 16 , 2004 .","The season was canceled on February 16 , 2005 because of an unfinished lockout that began on September 16 , 2004 ."
3108,Joan Hinde ( 21 October 1933 -- 22 January 2015 ) was a British trumpeter and entertainer .,Joan Hinde ( 21 October 1933 - 22 January 2015 ) was a British trumpeter and entertainer .
3109,Yonezawa had been in debt for roughly a hundred years when Harunori took over ; Shigesada even considered returning the domain to the shogunate as a last resort .,Shigesada had thought about returning the domain to the shogunate because of the debt .
3110,Buddhism .,In Buddhism .
3111,Raid .,The raid .
3112,"The 1997 movie `` Contact '' , based on Sagan 's novel of the same name and finished after his death , ends with the dedication `` For Carl '' .","The 1997 movie `` Contact '' ( see above ) , based on Sagan 's novel of the same name , and finished after his death , ends with the dedication `` For Carl . ''"
3113,Niedergösgen is a municipality in the district of Gösgen in the canton of Solothurn in Switzerland .,Niedergösgen is a municipality in the district Gösgen in the canton of Solothurn in Switzerland .
3114,"Well known as the place where King Danjong , the sixth king of Joseon Dynasty , was exiled when he was forced to abdicate by his uncle , who became Sejo of Joseon .","It is well known as the place where King Danjong , the sixth king of Joseon Dynasty , was exiled to , when he was forced to abdicate by his uncle , who became Sejo of Joseon ."
3115,"She has twice been awarded the Golden Rooster and the Hundred Flowers Awards as well as the Berlinale Camera , Cannes Festival Trophy , National Board of Review , New York Film Critics Circle Award , and Volpi Cup .","She received both the Golden Rooster and the Hundred Flowers Awards two times . She also has the Berlinale Camera , Cannes Festival Trophy , National Board of Review , New York Film Critics Circle Award , and Volpi Cup ."
3116,"She is best known for her roles as Alison Parker on `` Melrose Place '' , Georgia Thomas on `` Ally McBeal '' , Cheryl in `` According to Jim '' , and her recurring role on `` Two and a Half Men '' as Lyndsey McElroy .","She is best known for her television work . Her television roles include Alison Parker on `` Melrose Place '' , Georgia Thomas on the sitcom `` Ally McBeal '' and Lyndsey McElroy on `` Two and a Half Men '' ."
3117,"Michael S. Stuhlbarg ( born July 5 , 1968 ) is an American actor .","Michael S. Stuhlbarg ( born July 5 , 1968 ) , is an American theatre , movie and television actor ."
3118,"In total , each team plays sixteen games and has one bye week , where they do not play any games .",Each team plays 16 games .
3119,Goals of the movement .,Goals of the Esperanto movement .
3120,Above it is a bar which shows two flowers on the sides and two cotton bolls in the center .,Above this is a bar which shows two flowers on the sides and two cotton bolls in the center .
3121,"She was voted one of the most popular people in both France and Belgium , and was compared to Mother Teresa , although she herself regarded the comparison as `` ridiculous '' .","She has been voted one of the most popular people in France , and has been compared to Mother Teresa ."
3122,Barium bromide can be prepared from barium sulfide or barium carbonate via reaction with hydrobromic acid to give hydrated barium bromide .,Barium bromide can be made by reacting barium carbonate with hydrobromic acid .
3123,A television director directs the activities involved in making a television program and is part of a television crew .,A television director directs the activities involved in making a television program . He or she is part of a television crew .
3124,"Baltix is an operating system for Lithuanian and Latvian people , based on Debian and Ubuntu .","Baltix GNU\/Linux is a Linux distribution aimed to be a complete , user-friendly operating system for Lithuanian and Latvian people , based on Debian and Ubuntu ."
3125,"He is the son of NHL Hall of Famer , Charlie Conacher .","His father was NHL Hall of Famer , Charlie Conacher ."
3126,"He joined another group , Los Chicos , they produced several hit recordings , including `` Puerto Rico Son Los Chicos '' and Ave Maria .","These include `` Puerto Rico Son Los Chicos '' and `` Ave Maria '' , which would later be recorded by Beyoncé Knowles ."
3127,"Darien is a town in Fairfield County , Connecticut , United States .","Darien is a rich town in Fairfield County , Connecticut , United States ."
3128,"Born in 1833 in Boston , Massachusetts , Seanor was living in New York when he joined the Navy .","Seanor was born in 1833 in Boston , Massachusetts ."
3129,"Fontainebleau ( ; ) is a commune in the metropolitan area of Paris , France .","Fontainebleau ( ] ) is a commune in the metropolitan area of Paris , France ."
3130,"They are native to western Africa - Nigeria , Cameroon , Gabon , northeastern Congo , Bioko and Equatorial Guinea .","They live in western Africa - Nigeria , Cameroon , Gabon , northeastern Congo , Bioko and Equatorial Guinea ."
3131,"The flesh-hungry undead have been a fixture of world mythology dating at least since The Epic of Gilgamesh , in which the goddess Ishtar promises : I will knock down the Gates of the Netherworld , I will smash the door posts , and leave the doors flat down , and will let the dead go up to eat the living !","If you do not give me the Bull of Heaven , I will knock down the Gates of the Netherworld , I will smash the doorposts , and leave the doors flat down , and will let the dead go up to eat the living !"
3132,"Terence V. Powderly Terence Vincent Powderly ( January 22 , 1849 -- June 24 , 1924 ) was an Irish-American politician and labor union leader , best known as head of the Knights of Labor in the late 1880s .",Terence V. Powderly Terence Vincent Powderly ( 22 January 1849 -- 24 June 1924 ) was an Irish-American politician and labor union leader .
3133,"However , by then the net of barricades , street fortifications , and tank obstacles were already well-prepared ; both sides reached a stalemate , with heavy house-to-house fighting .","However , by then the barricades , street fortifications , and tank obstacles were well-prepared . Both sides reached a stalemate ( a situation in which no side could win ) , with violent house-to-house fighting ."
3134,Country dancing is also known as `` kicker dancing '' in Texas .,It is also called kicker dancing in Texas .
3135,"Despite the lack of impact , the storm 's remnants were caught in an upper-level jet stream , and steered towards Europe .","But , the storm 's remains were caught in an upper-level jet stream , and was pushed towards Europe ."
3136,"When he argues with Dory and accidentally gives her a nosebleed , the blood scent causes Bruce to enter a feeding frenzy .","However , when he argues with Dory and accidentally gives her a nosebleed , the scent of blood causes Bruce to lose control of himself and attempt to eat Marlin and Dory ."
3137,"Cookies appear to have their origins in 7th century AD Persia , shortly after the use of sugar became relatively common in the region .","Cookies were made at first in 7th century AD Persia , just after the use of sugar became common there ."
3138,"In Europe , the Common Crane predominantly breeds in boreal and taiga forest and mixed forests , from an elevation of sea-level to 2,200 m ( 7,200 ft ) .","In Europe , the Common Crane breeds in boreal and taiga forest and mixed forests , from sea-level to 2,200 m ( 7,200 ft ) ."
3139,"Kyneton is home to mineral springs , the Campaspe River , botanical gardens and historic houses , many with bluestone architecture .","Kyneton is famous for its springs , the Campaspe River , public gardens and old houses , many built from stone ."
3140,"Earlville is a city in LaSalle County , Illinois , United States .",Earlville is a city of Illinois in the United States . It is in LaSalle County .
3141,"For years after the war he continued to serve , returning to the USSR only in the mid-1950s .",He returned to the USSR only in the mid-1950s .
3142,"On the October 20 episode of ECW , Tatsu defeated Zack Ryder to become number one contender for the ECW Championship , although he failed to win the championship the following week against Christian .","On the October 20 episode of ECW , Tatsu was involved in a number one contender 's match for the ECW Championship against Zack Ryder who he defeated to become the number one contender for the title ."
3143,"The film received only one Golden Globe Award , for Best Film Actress in a Musical or Comedy ( Diane Keaton ) , despite nominations for three other awards : Best Motion Picture ( Musical or Comedy ) , Best Director , and Best Film Actor in a Musical or Comedy ( Woody Allen ) .","The movie won one Golden Globe Award , for Best Actress in Musical or Comedy ( Diane Keaton ) ."
3144,The TAR was seen as a way to accommodate the huge increases in international trade between Eurasian nations and facilitate the increased movements of goods between countries .,The TAR was seen as a way to handle the huge increases in international trade between Eurasian nations .
3145,"One notable example is the 1963 March on Washington for Jobs and Freedom , a political rally for African American civil rights , at which Martin Luther King , Jr. gave his famous `` I Have a Dream '' speech .","One of the most famous was the March on Washington for Jobs and Freedom in 1963 , where Martin Luther King , Jr. gave his I Have a Dream speech ."
3146,"A futon is traditional Japanese bedding consisting of padded mattresses and quilts pliable enough to be folded and stored away during the day , allowing the room to serve for purposes other than as a bedroom .",Futons are traditional Japanese bedding .
3147,The Scandinavian Mountains or the Scandes is a mountain range that runs through the Scandinavian Peninsula .,The Scandinavian Mountains are a mountain range that runs through the Scandinavian Peninsula .
3148,"In the mid-1980s , she starred in the television series `` Falcon Crest '' as Francesca Gioberti , a role originally written for Sophia Loren , who had turned it down .","In the mid-1980s , she starred in the television series `` Falcon Crest '' . The role was written for Sophia Loren , who turned it down ."
3149,It ranks number 1 in The Banker 's Top 1000 World Banks ranking and number 1 on Forbes Global 2000 list of the world 's biggest public companies .,"In 2013 , it was ranked number 1 on `` Forbes '' Global 2000 list of world 's biggest public companies . Other Websites ."
3150,"Cruel Intentions ( 1999 ) , a modern-day retelling of Les Liaisons dangereuses featured a kiss between Gellar and co-star Selma Blair that won the two the `` Best Kiss '' award at the 2000 MTV Movie Awards .",The movie had a lesbian kiss between Gellar and co-star Selma Blair that won the `` Best Kiss '' award at the 2000 MTV Movie Awards .
3151,"Baryonyx ( \ / ˌbæriˈɒnɨks \ / ; Greek : βαρύς \ / barys meaning ` heavy ' and ὄνυξ \ / onyx meaning ` claw ' or ` nail ' ) is a genus of carnivorous saurischian dinosaur first discovered in clay pits just south of Dorking , England , and later reported from fossils found in northern Spain and Portugal .","Baryonyx was a carnivorous dinosaur discovered in clay pits just south of Dorking , England , and also in northern Spain ."
3152,"In the form of proteins , amino acids comprise the second-largest component ( water is the largest ) of human muscles , cells and other tissues .",Amino acids are the building blocks of proteins .
3153,"Grain legumes include beans , lentils , lupins , peas , and peanuts .",Legumes can be a variety of fruits : peas and beans are types of legumes .
3154,"This is often supplemented by frogs , crayfish and crabs .","They eat fish , crayfish , crabs , and frogs ."
3155,The score before the last game was thus 5-4 for Schlechter .,The score before the last game was 5-4 for Schlechter .
3156,Some of these sharks are believed to be family members who died and have been reincarnated into shark form .,Some of these sharks are believed to be family members who have died and have turned into sharks .
3157,She is one of the most recognized and versatile Mexican actresses worldwide .,She is one of the most recognized and versatile Mexican actresses .
3158,"Kerrigan married her agent , Jerry Solomon , on September 9 , 1995 , the year after she retired from competition .","Kerrigan married her agent , Jerry Solomon , on September 9 , 1995 ."
3159,"Its jurisdiction covered most of the Hazara region including Abbottabad itself , Haripur , Mansehra and the Galyat hill tracts .","Its jurisdiction covered most of the Hazara region including Abbottabad , Haripur , Mansehra and the Galyat hill tracts ."
3160,"It was first described in rainbow trout in Germany a century ago , but its range has spread and it has appeared in most of Europe ( including Russia ) , the United States , South Africa and other countries .","In the last 100 years , it has spread to most of Europe ( including Russia ) , the United States , South Africa , and other countries ."
3161,"Ponders End railway station is in the London Borough of Enfield in north east London at Ponders End , and is in Travelcard Zone 5 , on the Tottenham Hale branch of the Lea Valley Lines , north of London Liverpool Street .","Ponders End railway station is in the London Borough of Enfield in northeast London at Ponders End , and is in Travelcard Zone 5 , on the Tottenham Hale branch of the Lea Valley Lines , 16 km ( 10 miles ) north of London Liverpool Street ."
3162,"Khiprianwala Island is a small island located in the Arabian Sea off the coast of Karachi , Sindh , Pakistan .","Khiprianwala Island is a small island in the Arabian Sea . It is off the coast of Karachi , Sindh , Pakistan ."
3163,"Some , unaware of the local terrain , ran towards the swamps where unknown numbers drowned . The Athenians pursued the Persians back to their ships , and managed to capture seven ships , though the majority were able to launch successfully .","Some , unaware of the local terrain , ran towards the swamps where unknown numbers drowned.p71 The Athenians pursued the Persians back to their ships , and managed to capture seven ships , though most were able to launch ."
3164,"Gradually they become involved with love , lust , and spiritually .","Gradually they become involved with love , lust and spiritually ."
3165,"Abstraction in philosophy is the process ( or , to some , the alleged process ) in concept formation of recognizing some set of common features in individuals , and on that basis forming a concept of that feature .","Abstraction in philosophy is the process ( or , to some , the alleged process ) in concept-formation of recognizing some set of common features in individuals , and on that basis forming a concept of that feature ."
3166,"Batman fights off the SWAT team and the Joker 's men , then rescues the hostages .",A SWAT team then captures the Joker .
3167,A rearrangement reaction is a broad class of organic reactions where the carbon skeleton of a molecule is rearranged to give a structural isomer of the original molecule .,A rearrangement reaction are organic reactions where the carbon skeleton of a molecule is rearranged .
3168,Its capital is the city of Rio Branco .,Its capital city is Rio Branco .
3169,"Previously , Georgian athletes competed as part of the Soviet Union at the Olympics from 1952 to 1988 , and after the dissolution of the Soviet Union , Georgia was part of the Unified Team in 1992 .","Previously , Georgian athletes were part of the Soviet Union at the Olympics from 1952 to 1988 ."
3170,"Camillo Paolo Filippo Giulio Benso , Count of Cavour , of Isolabella and of Leri ( August 10 , 1810 -- June 6 , 1861 ) , generally known as Cavour ( ) was an Italian statesman and a leading figure in the movement toward Italian unification .","Camillo Paolo Filippo Giulio Benso , Count of Cavour , of Isolabella and of Leri ( August 10 , 1810 -- June 6 , 1861 ) , better known as Camillo Cavour or simply Cavour , was an Italian politician and statesman ."
3171,"Colorectal cancer ( also known as colon cancer , rectal cancer , bowel cancer or colorectal adenocarcinoma ) is a cancer from uncontrolled cell growth in the colon or rectum ( parts of the large intestine ) , or in the appendix .","Colorectal cancer , also known as colon cancer , rectal cancer , or bowel cancer , is a cancer in the colon or rectum ( parts of the large intestine ) , or in the appendix ."
3172,"In 1841 , Horatio Wills , on his way to selecting country further south , wrote in his diary , `` like the Ark we rested '' and named a nearby hill Mt Ararat .","In 1841 , Horatio Wills , on his way to land further south , wrote in his diary , `` like the Ark we rested '' ."
3173,"These and other differences show that the fungi form a single group of related organisms , named the Eumycota ( true fungi or Eumycetes ) , that share a common ancestor ( is a monophyletic group ) .","These and other differences show that the fungi form a single group of related organisms , called the Eumycota or Eumycetes ."
3174,"Additionally , he won a Hugo Award and a Nebula Award for `` Young Frankenstein '' .",He also won a Hugo Award and a Nebula Award for `` Young Frankenstein '' .
3175,Proog tries to introduce Emo to The Machine 's nature but Emo is reluctant and argues about The Machine 's purpose .,"Proog tries to introduce Emo to its nature , but Emo is reluctant ( If a person is reluctant to do something , he\/she does not want to do it . )"
3176,"In 1978 , U Thant 's memoirs , View from the UN , were posthumously published , initially by the American publishing house Doubleday .","In 1978 , U Thant 's memoirs View from the UN was published , by the American publishing house Doubleday ."
3177,"Additionally , the guest vocalist was originally going to be Spears , but ultimately Gaga made Beyoncé the featured vocalist instead .","Additionally , the guest vocalist was originally going to be Spears , but ultimately Gaga made Knowles the featured vocalist instead ."
3178,"Theydon Garnon is a village and a civil parish in the Epping Forest District , in the county of Essex , England .","Theydon Garnon is a village and civil parish in Epping Forest , Essex , England ."
3179,"In the `` Hitman '' game series , Bateson provided the voice and physical guide of Agent 47 and served as the character model in every entry in the series until the fifth game , '' '' , when he stated to a member of a `` Hitman '' fan forum that `` No one from IO Interactive is answering my calls , e-mails or sms . ''","In the `` Hitman game series '' , Bateson provided the voice , physical guide and appearance of Agent 47 . He stayed as the character model until the fifth game , '' '' , when he said to a member of a `` Hitman '' fan forum that `` No one from IO Interactive is answering my calls , e-mails or sms . ''"
3180,"According to Gilbert Burnet , however , Mary convinced her husband that she did not care for political power , and told him `` she would be no more but his wife , and that she would do all that lay in her power to make him King for life '' .","She said `` she would be no more but his wife , and that she would do all that lay in her power to make him King for life '' ."
3181,"In 1957 , she made a state visit to the United States , where she addressed the United Nations General Assembly on behalf of the Commonwealth .","In October 1957 , she made an official visit to the United States ."
3182,Many of the national team footballers are celebrities across Sierra Leone and they are often well known by the general population .,Many of the national team footballers are celebrities across Sierra Leone . They are often well known by most of the country 's general population .
3183,"The Toronto Sun is an English-language daily tabloid newspaper published in Toronto , Ontario , Canada .","The Toronto Sun is an English language daily tabloid newspaper published in Toronto , Ontario , Canada ."
