,#1 String,#2 String
0,Why in India do we not have one on one political debate as in USA?,Why cant we have a public debate between politicians in India like the one in US?
1,What do you think will be the effect of Modi Government's decision of invalidating the RS 500 and RS 1000 notes?,What are the full implications of the Indian government's decision to withdraw all the old 500 and 1000 rupee notes from circulation?
2,What is OnePlus One?,How is oneplus one?
3,Does our mind control our emotions?,How do smart and successful people control their emotions?
4,What made Islam spread around the world faster than any other religion?,How did Islam spread to all the world?
5,What do people around the world typically wear to sleep?,What do you usually wear to sleep?
6,How can I become an airline pilot?,What do you have to do to become an airline pilot?
7,What is a public limited company?,What is a public limited company? What are some benefits?
8,How do you think President Obama will go down in history?,Will Obama go down in history as a great president?
9,What's the absolute easiest way to commit suicide?,"What is the cheapest, easiest, least painful way to commit suicide?"
10,What are the best ways to study/memorize things?,What is the best way to memorize things?
11,"Can imaginary time, energy and gravity exist?",Does imaginary gravity exist?
12,Which books are good for improving English?,What are some good books or resources to improve English?
13,What is aptitude test?,What is an aptitude test?
14,What is the best CP valued Pokémon that you have?,What is the highest limit for Pokémon CP in Pokémon GO?
15,How dangerous is a German Shepherd/Border Collie mix?,How friendly is a German Shepherd/Border Collie mix?
16,What are the best things to do in Hong Kong?,What is the best thing in Hong Kong?
17,Does anyone believe that there is life on other planets?,Is there life on other planets besides earth?
18,Are you guys voting for Hillary Clinton or Donald Trump?,Who would you vote for: Donald Trump or Hillary Clinton?
19,How do we know for sure that nothing is faster than light?,Why I can't go faster than light?
20,What is the easiest method to clean shave bikini area at home?,How do you completely shave your bikini area?
21,What were the books Aman Bansal used for his Jee preparation?,Which books were used my Aman Bansal for JEE preparation?
22,How do I make my girlfriend happy on her birthday?,What is the best gift I can buy for my girl to make her feel special on her birthday?
23,What are your thoughts on Child Support?,What is your review of Child Support?
24,"Is Earth a prematurely Inhabited Planet, because the universe is too young?",Is Earth a prematurely Inhabited Planet?
25,What are good ways to start a business intelligence startup?,What are good ways to start a startup in the business intelligence niche?
26,Where can I get the best rates on cruises?,Where can I get the best price on a cruise?
27,"What is the witching hour in occult belief, and why is it at 3 AM? How does it compare to the Devil's hour?",Why is 3 am called the witching hour?
28,What are the best gate coaching classes for mechanical engineering in Mumbai?,What are some good GATE coaching classes for Mechanical Engineering in Mumbai?
29,How do I get into internships?,How do you get internships?
30,Why is Arnab Goswami resigned as the Editor-in Chief of Times Now and ET Now?,Why did Arnab Goswami quit TIMES NOW?
31,How does Donald Trump expect Mexico to pay for his proposed border wall?,How Donald Trump will make Mexico pay for the wall?
32,Can I track a stolen phone?,My phone has been stolen. How do track my phone?
33,Where can I get highest quality service at exceptional prices in Sydney for property conveyancing?,Where can I get quality support to make a successful property transaction process in Sydney?
34,"If I burn a 1000 rupee note, will India get poor by a thousand rupee? How will it affect India's GDP, considering the demonitization of notes?","If I burn a Rs. 1000 note, how does it affect the country?"
35,"Are there iTunes gift cards? If so, where can they be purchased at in the US?",How can I get free iTunes gift cards online?
36,Does love always hurt?,Does true love always hurt or die?
37,What is the best part time job while you are already working in Bangalore?,What can one do part time to earn some money while working in Bangalore?
38,Has wizard magic been scientifically tested?,Have wizards been scientifically tested?
39,Is obc certificate from state government valid in national level?,Is caste certificate of one state and domicile of another state is valid for government exams?
40,How do I make a rocket?,How do you make a DIY rocket that works?
41,Is World War III on its way right now?,Do you think we are on the verge of World War III?
42,Why do I need to be 18 years old to do anything?,Why do I have to be 18 years old to do anything?
43,What is a j2ee?,What is difference between core java and j2ee?
44,How should you treat a mouse bite?,How do you treat a mouse bite?
45,Why does Quora seemingly always tell me that my questions need improvement when they are clear and concise questions?,Why are some questions on Quora flagged as needing improvement when they don’t need improvement?
46,Why did my family member say I need to grow up a little?,Why did my family member say I need to grow up?
47,What scares Indian men?,Indian Men: What scares Indian men?
48,Is Somaliland even a country? Elaborate if yes or no,Is somaliland a country?
49,How do I easily crack the GRE with good score?,What are the steps to crack GRE with good scores?
50,How the way to speak english fluently?,How can I learn to speak English fluently?
51,How do people join ISIS?,What makes a person join ISIS?
52,When will be end of world?,What is the end of this world?
53,What or Who is a furry?,What is a furry?
54,What is the best way to lose weight and not gain it back?,What is the best weight loss method?
55,Do people have sex with animals?,Do people really have sex with animals?
56,"If you could change one thing about the education system, what would it be?","If you could change anything about education, what would it be and why?"
57,Why did MS Dhoni quit ODI and T20 captaincy but will still play?,Why has Dhoni left the captaincy from ODI and T20?
58,"If a woman has a choice in abortion, why should the father be liable for child support?","If a woman chooses to keep a pregnancy when her partner prefers that she have an abortion, why should he have to pay child support?"
59,How can we change our habits?,How can I change all of my habits?
60,How does the inside of a vagina feel?,What does the inside of a vagina feel like?
61,How can I improve my spoken English?,What should I do to improve my spoken English?
62,Is it healthy to eat egg whites every day?,"Are peanuts healthy, especially to eat every day?"
63,"What is the rule for a ""follow on"" in Test Cricket?",How is follow on is decided in test cricket?
64,What are some disadvantages of an informal economy?,What are some of the disadvantages of an informal economy?
65,Which is your favorite chocolate and Why?,Which is your favourite chocolate brand?
66,Is it possible to hack WhatsApp from a laptop through long distance?,How can I hack someone's WhatsApp account?
67,How can I reduce my chubby tummy?,How do I reduce my tummy fat?
68,What programming languages should I learn for video game development?,What programming language should I learn if I want to create games?
69,Can I produce a product patented in 1916 but never made?,Can I use a patent from 1916 that was never produced?
70,What is the difference between right and left politics?,What is the concept of right wing and left wing?
71,What is the difference between a Chartered certified accountant and chartered accountant?,What is the difference between a certified and a chartered accountant?
72,What are the best companies to work for as a software engineer?,What is the best company to work as software engineer?
73,What is the most followed topic on Quora?,What are the 50 topics with the most followers on Quora?
74,How do I set the font size in Quora?,How could I set the font size in Quora?
75,Is time travel possible? If yes? How?,Do you think time travel is possible?
76,What are your three wishes for the genie lamp?,"If a genie grants you three wishes, what do you intend to wish for?"
77,How can you overcome phobia of mathematics?,Can I overcome a phobia of mathematics?
78,"If you had a chance to be reborn in a country of your choice, which country would it be?","If given a chance to be reborn in a country of your choice, what country would you choose over your native country?"
79,What were all of Nero’s accomplishments?,What were Nero's greatest accomplishments?
80,How I can earn lots of money?,How can I earn money?
81,What would be effect of 500 and 1000 Rs notes ban?,"What are you views, pros, cons on ban of 500 and 1000 notes by goverment?"
82,Which is the best API for generating term document matrix in Java?,Which is the best API in Java for generating term document matrix?
83,What are the major characteristics of Italian leather?,What's so great about Italian leather?
84,How do I start preparation for cracking the IAS exam? What are some good books and ideas as I am from a middle class family?,How do I start preparation for IAS exam?
85,How can you make someone think something was their own idea?,What is the best way to convince someone to think something?
86,Which characteristics of men is attracted by women the most?,Which quality of men attracts the women most?
87,Whom do you love the most?,Whom do you love the most and why?
88,What are the best apps for blocking unwanted calls?,What is the best app to block unwanted voice messages and calls?
89,What do Australians think about Indonesia?,What do Australians think of Indonesia in general?
90,What are the Top mba colleges in india with better placemens?,What are some best MBA colleges are there in India?
91,Do black holes have infinite density?,"How can black holes be infinitesimally small, therefore having infinite density? It would make more sense for a black hole to be incredibly dense."
92,What are the reasons that people dislike Hillary Clinton?,Why do so many people say Hillary Clinton is evil?
93,Which can be the best laptop under 30000?,"which laptop will be best under Rs 30,000?"
94,What is a paradox in figurative speech? What are some examples?,"What is the meaning of ""paradox"" in figure of speech? What are some examples?"
95,How can I lose weight loss?,How can I lose weight safely?
96,How is college life like?,What is college life like?
97,How do I find the Nth prime number efficiently when N is as large as 100000000?,Is there any formula for finding nth prime number?
98,When is RRB senior section engineer exam conducted?,When is the RRB senior section engineer exam conducted?
99,Has anyone traded binary options?,Does anybody trade binary options?
100,What is VLSI /ASIC DESIGN?,What is difference between ASIC and VLSI design?
101,How can I reduce my Belly and tummy fat?,How do I reduce belly fat in minimal time?
102,What's the purpose of a human life?,"From your perspective, what is the purpose of life?"
103,How does one overcome feeling inferior?,How can one overcome the fear of inferiority?
104,What is your review of Raipur Institute Of Technology?,What is the review of raipur institute of technology?
105,What can I do to get better grades?,How do I improve my grades?
106,Why do IT companies want their employees to give them passport copies?,Why do IT companies want their employees to give passport copies?
107,Which is your favourite song and why?,What is your favorite song or what song do you recommend?
108,What is the scariest experience you've ever had?,What was the scariest experience you ever had?
109,How can I lose 25 pounds in a month?,What is the best diet to lose 30 pounds in a month?
110,What is the easiest way to take green card?,Who can help me get an America green card?
111,What is the difference between a cell phone and mobile phone?,Why is a mobile phone also called a cell phone?
112,Is it illegal to download movie with torrent in India?,Is it true that one should not download a movie from any torrent website in India?
113,How do human and plant cells differ?,How do animal cells and plant cells differ?
114,What is the taste of semen?,Does semen taste good?
115,What is means love?,What is the exact meaning of love?
116,Why doesn't Hillary Clinton win the White House if she won the popular vote?,What's your feeling on the fact Hillary Clinton won popular vote while losing the election?
117,How do you download photos from iCloud?,How do I restore pictures from iCloud?
118,Can I increase my height after 20 ? How?,Does height increase after 21? How can I get taller?
119,Which is the best korean drama of all time?,What is the best Korean drama?
120,How does the roles of man differ based on the persona's description?,How do the roles of man differ based on the persona’s description?
121,What are the best ways to improve English?,What is the best way to improve my spoken English soon?
122,What do Americans think about Donald Trump?,What do you think about the rapist Donald Trump?
123,Is it healthy to eat fish every day?,"Are peanuts healthy, especially to eat every day?"
124,How do I improve my pronunciation in English?,I want to improve my English?
125,"Since Trump will be the president, does he have to show us his tax returns?",Does Trump have to make his tax return public once he is sworn in?
126,What are your favorite photos of yourself?,Which is your favourite picture of yourself?
127,How can one grow a thick beard at a faster rate?,How do I grow a beard fast?
128,Is there a way to permanently change your eye color?,Is it possible to permanently change the color of the eye?
129,What is the best way or resources to learn english like a native speakers?,How can I learn English well？?
130,How can I make my money make money?,What is the best way make extra money?
131,What is the smartest thing you have seen somebody do?,What is the smartest thing anyone has ever done?
132,What are some sites from which I can earn money?,What are some websites where we can earn money?
133,How can I get my first book published?,How can I get a story I wrote published?
134,How can you increase your height?,What do I do to increase my height?
135,What's a way to last longer during sex? (For guys)?,How can I last for a longer time during sex?
136,Can someone travel back in time?,Can we travel in time?
137,How do I gain access to my gmail when I don't have access to the phone number or recovery email?,How can I reset my Gmail password when I don't remember my recovery information?
138,Where is the best Whirlpool Refrigerator Service Center in Hyderabad?,Where is located the best Whirlpool Refrigerator Service Center in Hyderabad?
139,What are personal attributes? What is their importance?,Why are personal attributes important?
140,How do I get meth out of my system in 3 days?,How do I get meth out of my system in 2 days?
141,When is the the right time to have sex?,When is the right time to have sex with someone?
142,How can gain my weight?,How can I gain weight?
143,What are the options for a chemical engineer after B.tech?,What are the career opportunities after finishing chemical engineering?
144,Will the value of Indian rupee increase after the ban of 500 and 1000 rupee notes?,How will India be affected now that 500 and 1000 rupee notes have been banned?
145,Is it true that there is life after death?,How would life be after death?
146,How do I get my 13-year-old daughter interested in programming?,How can I interest my thirteen year old neighbour to get into programming?
147,"Why did the Philippine president Rodrigo Duterte call Barack Obama a ""son of a bitch""?",Why is it correct for the Philippine President to call the U.S. son of bitch in the world?
148,Why were the 500 and 1000 rupee notes demonetized?,Why is the 500 rupee note banned in India?
149,Would you rather vote for Donald Trump or Hillary Clinton? Why?,Would you rather have Donald Trump or Hillary Clinton be POTUS?
150,What song fits the theme of your life?,What is the theme song to your life?
151,How do I remove the annoying Anti Trump questions from my feed?,How do I stop the donald trump questions on my Quora feed?
152,What is the best way to control our emotions?,How do I control anger and impulsive emotions?
153,What is the best way to start writing a book?,How do I start writing my own book?
154,Do you think racism still exists in our society today?,Does racism still exist in this generation?
155,Can you suggest me any jobs for work from home?,Can you Suggest me some good work from home jobs - online work ?
156,What is the GRAND purpose of life?,What according to YOU is the purpose of life?
157,Why do fusion reaction and fission reaction both release energy?,How can nuclear fission and nuclear fusion reactions both release energy when they're the opposite of each other? How exactly does this work?
158,How can you calculate the value of P on Excel?,How do you calculate a P value on Excel?
159,How can I reduce my belly fat in 2 months?,How can I reduce my belly fat through a diet?
160,"What's the main difference between the words ""people"" and ""persons""?",What is the difference between people and a persons?
161,How did you catch your spouse cheating?,How can I find out if my husband is cheating?
162,Do you think Donald Trump or Hillary Clinton will be the next president of the US?,Who will be the next president of USA 2016?
163,"If Asian isn't a race, how can you be racist towards Asians?",How can you be racist against Asians?
164,Is there any life in Mars?,Does life exits on mars?
165,I really like this girl but but she has a boyfriend what should I do?,Dating Advice: I really like a girl but she already has a boyfriend. What should I do?
166,What is your purpose of life?,What is my purpose in life? Why is there life on Earth?
167,What promotions can we get in SBI clerk?,What promotions for SBI clerk?
168,Where can I sell my idea?,Where can I sell entrepreneur ideas?
169,What is your all time favorite book?,"What is your favorite book, why?"
170,Was there anyone who prospered (legally) during the Great Depression?,What companies benefited from the Great Depression?
171,Are you the black sheep of the family?,Are you the black sheep of your family?
172,What will be the effect of banning 500 and 1000 notes on gold rate and real estate?,What will be the effect of note ban in real estate?
173,Is there a framework for auditing social media?,Is there a template or a framework for social media audit?
174,"Who came first, hen or egg?",Which comes out first the hen or the egg?
175,Why are Saltwater taffy candy imported in the Philippines?,Why is Saltwater taffy candy imported in Japan?
176,Who invented automobile?,Who invented the automobile?
177,Why can’t India be a communist country like China?,Would India ever be a communist nation like China?
178,Why was the Bill of Rights necessary?,Why was bill of right important?
179,Why is salt water taffy candy imported in France?,Why is Saltwater Taffy candy imported in Mexico?
180,What are great examples of absent mindedness?,What are some of the great examples of absence of mind?
181,How can I get a employment based Green Card for living and working in USA?,How can I get a green card to live and work in the USA?
182,What is the best way to become rich?,"Rich people of Quora, what should I do to become rich?"
183,What are some characteristics of eccentric and concentric contractions?,What are some symptoms of eccentric and concentric contractions?
184,How can I improve my English reading comprehension?,How do I improve my reading comprehension in English more efficiently?
185,Is it appropriate for a woman to show cleavage?,Is it appropriate for a women to show cleavage?
186,What is the use of demonetizing Rs. 500 & Rs. 1000 notes?,What do you think of the decision by the Indian government to demonetize 500 and 1000 rupee notes?
187,Why do all of my questions on Quora need improvement?,Is there a way on Quora to ask why a specific question was marked as needs improvement?
188,Career Advice: What is the reason many engineering students can't get jobs in India?,What is the reason lots of engineering students can't get a good job in India?
189,How can I change my profile picture on Quora?,How do I use my picture as my profile picture on Quora?
190,Are there any Q & A sites that are better than Quora?,Is there an intellectual Q&A site better than Quora?
191,Who will win the US presidential elections 2016: Hillary Clinton or Donald Trump?,"Who's going to win and become president, Hillary Clinton or Donald Trump?"
192,What are some simple life hacks?,What are some simple life hacks that everyone should follow?
193,What are some of your little side hustles that make you extra money every month?,"What are some great side hustles, I want to make extra money every month?"
194,What is the most efficient way to make money?,What is the best way to make money make more money?
195,How is it to work for Elon musk?,How is it to work with Elon Musk?
196,How can I get rid of big flying cockroaches?,How can I get rid of flying cockroaches?
197,How do men last longer in bed?,How can I last for a longer time during sex?
198,What is the wisest/smartest thing you've ever heard a child say?,What is the smartest thing you've ever heard a child say? Andy
199,How do I acquire a British accent?,How do I develop a british accent?
200,What are the best cities in USA with low cost of living?,What is the best city in USA with low cost living?
201,Which is the best cell phone under 10k INR?,Which is the best Android phones under ₹10k?
202,What are Bitcoin and Bitcoin mining?,What is the significance of bitcoin mining in bitcoin industry?
203,"I am currently pursuing btech from NSIT COE(1st yr), I want to join MIT(US) for MS program after, what are the all steps in detail to be followed?","I'm currently pursuing B.E. (IT) at NSIT, Delhi, want to pursue MS from MIT/Stanford/other top American college. I am a sophomore. What should I do?"
204,How many times we can we masturbate in a week?,How many times should I masturbate in a week?
205,Where can I get best support in Sydney for buying a property?,Where can I get best conveyancing professionals in Sydney specialising in both buying and selling real estate and other properties?
206,Why are Indians so obsessed about what people from other countries think about India?,Why do Indians care so much about what others think about them?
207,What is the best comedy movies you have been watched?,What is your best comedy movie?
208,Can someone listen to only Metal? (Not ACDC and Led Zepplin but heavy stuff) Do you or anyone else you know listen to only Metal? Is it possible?,Can someone listen to only metal (not ACDC and Led Zeppelin but heavy stuff)? Do you or anyone else you know listen to only metal? Is it possible?
209,How can I learn self-hypnosis?,How should I begin with self-hypnosis?
210,How can I become more observant?,What are ways to become more observant?
211,How many types of hard disk?,What are the main types of hard drives?
212,What is your greatest achievement?,Which is your greatest achievement?
213,What are some best way to reduce mental stress quickly?,What is your favorite way to reduce stress?
214,Can you get pregnant before ever getting your first period?,What age did you begin your period and can you get pregnant before it?
215,What does Balaji Vishwanathan think about the ban of ₹500 and ₹1000 currency notes in India?,What do you think about banning ₹500 and ₹1000 notes?
216,What are the areas that can be improved in any organization?,What are the areas that can be improved in any organizations?
217,Why is Starbucks in India overrated?,Is Starbucks overrated in india?
218,What are the safety precautions on handling shotguns proposed by the NRA in Arkansas?,What are the safety precautions on handling shotguns ?
219,What are some warm blooded animals and what are their differences with cold blooded animals?,How do warm blooded and cold blooded animals compare and contrast?
220,"Where can I get weed (cannabis, marijuana) in Bangalore?","Where can I get some high quality weed (cannabis,marijuana) in Bangalore?"
221,What personal habits are typically associated with highly successful people?,What are a few of the habits that successful people do daily?
222,What were the weaknesses of the Articles of Confederation? What were the strengths?,What were the strengths and weaknesses of the Articles of Confederation?
223,Who is god? Has anybody seen god?,"If Jesus is God, then who is God?"
224,Does penis size matter for girl or stamina?,Does penis size matters for girls?
225,What role does catharsis play in Greek tragedy? How often was it used?,What is the function of catharsis in a tragedy?
226,How can skinny men get six packs?,How can everyone get a six pack?
227,What do you think is the most inspirational movie of all time?,What is the most inspiring movie you have ever seen?
228,What are the best board games?,What is the best board game ever?
229,What are some of unbelievable conspiracy stories?,What are some of the unbelievable conspiracy stories?
230,What are the advantages of federalism?,What are the advantages of cooperative federalism?
231,What is a sure way to commit suicide?,What is the least painful and best way to commit suicide?
232,Are cats scared of cucumbers?,Why cats scared by cucumbers?
233,Why do people play lots of cards during Diwali?,Why do people play cards Diwali night?
