,#1 String,#2 String
1454,"Since then , several other high-resolution structures have been determined by electron crystallography , including the light-harvesting complex , the nicotinic acetylcholine receptor , and the bacterial flagellum .","Since then , several other high-resolution structures have been done by electron crystallography , including the light-harvesting complex , and the bacterial flagellum ."
1455,"Film critic Roger Ebert gave the film a rare zero-stars rating , listed it as one of his most hated films of all-time , describing the film thus : `` This movie does n't scrape the bottom of the barrel .",Movie critic Roger Ebert rated the movie a rare zero-stars rating and listed it as one of his most hated movies of all-time . He described the movie as : `` This movie does n't scrape the bottom of the barrel .
1456,"The bean machine , also known as the quincunx or Galton box , is a device invented by Sir Francis Galton to demonstrate the central limit theorem , in particular that the normal distribution is approximate to the binomial distribution .","The bean machine , also known as the quincunx or Galton box , is a machine invented by Sir Francis Galton to demonstrate the law of error and the normal distribution ."
1457,"Brian Michael Heffron ( born May 18 , 1973 ) , better known by the ring name The Blue Meanie , is an American professional wrestler and actor .","Brian Daniel Heffron ( born May 18 , 1973 ) is an American professional wrestler and actor . He is better known by his ring name The Blue Meanie ."
1458,"As well as composing prolifically , Dupré prepared study editions of the organ works of Bach , Handel , Mozart , Liszt , Mendelssohn , Schumann , César Franck , and Alexander Glazunov .","As well as composing lots of music , Dupré prepared study editions of the organ works of Bach , Handel , Mozart , Liszt , Mendelssohn , Schumann , César Franck , and Alexander Glazunov ."
1459,Elkanah Settle ( 1 February 1648 - 12 February 1724 ) was an English poet and playwright .,Elkanah Settle ( 1648-1724 ) was an English poet and playwright .
1460,"Sean James Pronger ( born November 30 , 1972 ) is a Canadian former professional ice-hockey player who grew up in Dryden , Ontario , and played in the National Hockey League from 1995 to 2004 . He played for the following teams : Mighty Ducks of Anaheim , Pittsburgh Penguins , New York Rangers , Los Angeles Kings , Boston Bruins , Columbus Blue Jackets and Vancouver Canucks , having been drafted 51st overall by Vancouver in 1991 .","Sean James Pronger ( born November 30 , 1972 in Thunder Bay , Ontario ) is a Canadian retired ice hockey player who grew up in Dryden , Ontario , and has played in the National Hockey League for the Mighty Ducks of Anaheim , Pittsburgh Penguins , New York Rangers , Los Angeles Kings , Boston Bruins , Columbus Blue Jackets and the Vancouver Canucks ."
1461,"However the group continues to operate under the constitutional guarantee of freedom of religion , funded by a successful computer business and donations , and under strict surveillance .","It is funded by a successful computer business and donations , and is kept under strict surveillance ."
1462,"She is the author of `` Nulato : An Indian Life on the Yukon '' , which was dedicated in memory of her son , Stewart , who died in 1975 in an auto accident .","She is the author of `` Nulato : An Indian Life on the Yukon '' . The book was dedicated to her son , Stewart , who died in 1975 in an auto accident ."
1463,"Jones reveals himself and threatens to destroy the Ark with a bazooka , but Belloq calls his bluff , knowing Jones can not bear to destroy such an important historical artifact .","Belloq calls Jones ' bluff , and Jones lowers his weapon ."
1464,"He ran for President of the United States in 1996 , 2000 , and 2008 ( founding and serving as the presidential nominee of the America 's Independent Party in 2008 ) , and was a Republican nominee for the U.S. Senate in 1988 , 1992 , and 2004 .","He ran for President of the United States in 1996 , 2000 , and 2008 , and was a Republican nominee for the U.S. Senate in 1988 , 1992 , and 2004 ."
1465,NU.nl NU.nl is a Dutch news website .,NU.nl is a Dutch news website .
1466,"The area was teeming with life , with millions of leaves , angiosperms ( the oldest known ) , insects , fish , frogs , salamanders , mammals , turtles , and lizards discovered to date .","The area was teeming with life , with millions of leaves , angiosperms ( the oldest known ) , insects , fish , frogs , salamanders , mammals , turtles , lizards and crocodilians discovered to date ."
1467,"His best known television series are ' , ' , '' '' , `` Without a Trace '' , `` Cold Case '' , and the U.S. version of `` The Amazing Race '' .","His best known television series are ' , ' , '' '' , `` Without a Trace '' , `` Cold Case '' , and `` The Amazing Race '' ."
1468,"At 2100 UTC , the NHC issued their final advisory on Tropical Depression One .","At 5:00 pm EDT ( 2100 UTC ) , the NHC gave out its last advisory on Tropical Depression One ."
1469,"Therefore , I was out .","Therefore , I was out . ''"
1470,The band was established in 1963 and performed for last time on 27 December 1999 .,"The band was established in 1963 . On 27 December 1999 , the band performed for last time ."
1471,"As a member of the IOC , FIDE adheres to its rules , including , controversially , a requirement for doping tests .","As a member of the International Olympic Committee , FIDE adheres to its rules , including controversially having doping tests ."
1472,"Having worked with Cary Guffey on `` Close Encounters of the Third Kind '' , Spielberg felt confident in working with a cast composed mostly of child actors .","Having worked with Cary Guffey on `` Close Encounters of the Third Kind '' , Spielberg felt confident in working with a cast of mostly child actors ."
1473,"She married the show 's host , Allen Ludden , in 1963 .","On June 14 , 1963 , White married television host and personality Allen Ludden ."
1474,"Laboratory rats have also proved valuable in psychological studies of learning and other mental processes ( Barnett , 2002 ) , as well as to understand group behavior and overcrowding ( with the work of John B. Calhoun on behavioral sink ) .","Laboratory rats have also proved valuable in psychological studies of learning and other mental processes ( Barnett , 2002 ) ."
1475,"The object of the game is to score cushion caroms , meaning a carom off of both object balls with at least one rail being struck before the hit on the second object ball .","The object of cushion caroms is to score cushion caroms , meaning a bounce off of both of the other balls on the table , with at least one rail of the table being struck by the cue ball before the contact with second object ball ."
1476,"Pike Road is a town in Montgomery County , Alabama , United States .","Pike Road is a city in Montgomery County , Alabama , in the United States ."
1477,"Observers believe that the church 's opposition and Bergoglio 's language worked in favor of the law 's passage and that in response , Catholic officials adopted a more conciliatory tone in later debates on social issues such as parental surrogacy .",Gay people believe that the church 's opposition and Bergoglio 's language worked in favor of the law 's passage and that in response Catholic officials adopted a more conciliatory tone in later debates on social issues such as parental surrogacy .
1478,"Adams won both of the two most prestigious British children 's book awards , one of six authors to do so : the Carnegie Medal and the Guardian Children 's Fiction Prize .","Adams won both important British children 's book awards , the Carnegie Medal and the Guardian Children 's Fiction Prize ."
1479,He had a significant contribution in the equipment of the Russian navy with new ships and in modernizing the naval ports .,He made a big contribution to re-equipping the Russian navy with new ships and in modernizing the naval ports .
1480,"Examples include Opabinia , with five eyes and a snout like a vacuum cleaner hose and Hallucigenia , which was originally reconstructed upside down , walking on bilaterally symmetrical spines .","Examples include Opabinia , with five eyes and a snout like a vacuum cleaner hose ; Nectocaris , and Hallucigenia ."
1481,"Dreier died on March 11 , 2000 in Rancho Mirage , California , from heart failure .","Dreier died on March 11 , 2001 in Rancho Mirage , California from heart failure , aged 83 ."
1482,"Alice claimed that she won $ 250,000 , which would now be worth more than three million dollars .","Alice claimed that she won $ 250,000 , which would now be worth over three million dollars ."
1483,"Wikipedia formerly used camel case linking as well , but switched to explicit link markup using square brackets and many other wiki sites have done the same .","Wikipedia used to use CamelCase linking . However , they have switched to explicit link markup using square brackets and many other wiki sites have done the same ."
1484,"Following yet another victory for Fianna Fáil at the 1969 general election , Hillery became Minister for External Affairs ( renamed Foreign Affairs in 1972 ) , one of the most prestigious of cabinet posts .","After another election win in 1969 Hillery became Minister for External Affairs ( renamed Foreign Affairs in 1972 ) , one of the top cabinet posts ."
1485,", one of the old provinces of Japan , encompassed the southern part of modern-day Gifu Prefecture .",", one of the List of Provinces of Japan , encompassed part of modern-day Gifu Prefecture on the island of Honshū ."
1486,"According to Emma Goldman : In 1898 , high bread prices led to demonstrations all over Italy .","In 1898 , the high bread prices led to demonstrations all over Italy ."
1487,"It was released on October 10 , 1995 by Trauma Records , a division of Interscope Records .","It was released on October 10 , 1995 on Trauma Records ."
1488,This condition turns out also to be sufficient-a result stated by Euler and later proven by Carl Hierholzer .,This result stated by Euler was later proved by Carl Hierholzer .
1489,"He has appeared in such films as `` The China Syndrome '' , `` Cocoon '' , `` The Thing '' and `` The Firm '' .","Brimley has appeared in the movies `` The China Syndrome '' , `` Cocoon '' , `` The Thing '' and `` The Firm '' ."
1490,The charge is the dominant shock attack and has been the key tactic and decisive moment of many battles throughout history .,The charge has been the key tactic and decisive moment of most battles in history .
1491,In 1996 he moved to Rockefeller University as a professor and head of the Laboratory of Molecular Neurobiology and Biophysics where he started to work on the structure of the potassium channel .,"In 1996 , he moved to Rockefeller University as a professor and head of the Laboratory of Molecular Neurobiology and Biophysics ."
1492,"On August 26 , 2015 , news reporter Alison Parker and photojournalist Adam Ward , employees of CBS affiliate WDBJ in Roanoke , Virginia , United States , were shot to death while conducting a live television interview near Smith Mountain Lake in Moneta .","On August 26 , 2015 , 24-year-old news reporter Alison Parker and 27-year-old photojournalist Adam Ward , both of Roanoke , Virginia , CBS affiliate WDBJ , were conducting a live television interview near Smith Mountain Lake in Moneta , Virginia , when they were murdered by a gunman ."
1493,"Existing fossils include a relatively small cranium known as Toumaï ( `` hope of life '' in the local Dazaga language of Chad in central Africa ) , five pieces of jaw , and some teeth , making up a head that has a mixture of derived and primitive features .","Some fossils , a cranium ( skull ) , five pieces of jaw , and some teeth , make up a head that has features that are like both modern and primitive humans ."
1494,"Naismith is at the top of massive and prestigious coaching tree , as he coached Naismith Memorial Basketball Hall of Fame coach Phog Allen , who himself coached Hall of Fame coaches Dean Smith , Adolph Rupp , and Ralph Miller who all coached future coaches as well .","Nevertheless , Naismith has one of the greatest coaching legacies in basketball history , as he coached Basketball Hall of Fame coach Phog Allen , who himself coached Hall of Fame coaches Dean Smith , Adolph Rupp , and Ralph Miller at the University of Kansas ."
1495,"The Arabic title of the Hakim , as transliterated , was Hakim al-Bahrayn ( English : Lord of Bahrain ) .",The Arabic title of the Hakim was Hakim al-Bahrayn .
1496,"James Stuart `` Jim '' Gilmore III ( born October 6 , 1949 ) is an American politician who was the 68th Governor of Virginia from 1998 to 2002 .","James Stuart `` Jim '' Gilmore III ( born October 6 , 1949 ) is an American politician . He was the 68th Governor of Virginia from 1998 to 2002 ."
1497,"On December 27 , 2013 , Brown was selected for the Pro Bowl as a receiver and a punt returner .",Brown spent time playing as a wide receiver and a returner .
1498,"Furthermore , the new demilitarized zone was mostly within the remaining territory of the discredited Manchurian warlord Zhang Xueliang .","Furthermore , the new demilitarized zone was mostly within the remaining territory of the Manchurian warlord Zhang Xueliang ."
1499,Chojnów is an industrial and agricultural town .,Chojnów is an industrial and agricultural city .
1500,The ads began airing in August 1991 and `` Be Like Mike '' became a household phrase in the United States .,The ads began airing in August 1991 and the phrase `` Be Like Mike '' became household lingo in America .
1501,It is within the Newry and Mourne District Council area .,It is in the Newry and Mourne District Council area .
1502,"`` The End '' was initially intended to be the final track on Abbey Road , but it is followed by `` Her Majesty '' .","`` The End '' was at first intended to be the final track on Abbey Road , but it is followed by `` Her Majesty '' ."
1503,"In 2000 , the original line of the game was discontinued and the AD&D version was renamed Dungeons & Dragons with the release of its 3rd edition with a new system .","After Wizards of the Coast bought the rights to Dungeons and Dragons , a more streamlined version of the game was released , called Dungeons and Dragons 3rd Edition ."
1504,Every month in a polar climate has an average temperature of less than . Regions with polar climate cover over 20 % of the Earth .,About 20 % of the Earth has a polar climate .
1505,"In an interview , Pokémon Diamond and Pearl director Junichi Masuda noted Lucario 's name as one of the most difficult to create , due to an effort to make it appealing to both Japanese and American audiences .","In an interview with Pokémon Diamond and Pearl director Junichi Masuda , he noted Lucario 's name as one of the hardest to make , because they wanted to make it work for both the Japanese and Americans ."
1506,"It is the German newspaper with the widest circulation abroad , with its editors claiming to deliver the newspaper to 148 countries every day .",It is the German newspaper with the widest circulation abroad .
1507,"The Sea of Monsters is followed by The Titan 's Curse , the third book of the five in the series .","The Sea of Monsters is followed by The Titan 's Curse , which is the third book of the five in the series ."
1508,"When Massasoit died , his son Wamsutta ( Alexander ) became his successor , but when Wamsutta also died in 1662 , Metacom ( Philip ) succeeded him .",When Wamsutta died Metacom ( Philip ) took his place .
1509,"About 4,000 people gathered at the cathedral for the service , including President and Mrs. Bush , former presidents George H. W. and Barbara Bush , Gerald and Betty Ford , Jimmy and Rosalynn Carter , and Bill and Hillary Clinton .","About 4,000 people gathered at the cathedral for the service , including President and Mrs. Bush , former president George H. W. and Barbara Bush , Gerald and Betty Ford , Jimmy and Rosalynn Carter , and Bill and Hillary Clinton ."
1510,"Agnes is in love with Elin , but can not find any way to express it .","Agnes has a crush on Elin , but can not find any way to express it ."
1511,"In 1966 , he heard a song about unrequited love written for The Spinners , and persuaded the writers that he should record it himself .","In 1966 , after hearing a song about unrequited love written for The Spinners , he persuaded the writers that he should record it himself ."
1512,Boisdinghem is a commune in the Pas-de-Calais department in the Nord-Pas-de-Calais region in northern France .,Boisdinghem is a commune . It is found in the region Nord-Pas-de-Calais in the Pas-de-Calais department in the north of France .
1513,"It also gives a behind-the-scenes glimpse into Disney 's Animal Kingdom 's animal care facilities , including a veterinary examination room complete with a two-way communications system so the veterinary staff can answer guest questions .","It also gives a behind-the-scenes look into Disney 's Animal Kingdom 's animal care facilities , including a veterinary examination room complete with a two-way communications system so the veterinary staff can answer guest questions ."
1514,"Nehemiah Grew ( 26 September 1641 - 25 March 1712 ) was an English plant anatomist and physiologist , very famously known as the `` Father of Plant Anatomy '' .","Nehemiah Grew ( 26 September 1641 - 25 March 1712 ) was an English plant anatomist and physiologist , the `` Father of Plant Anatomy '' ."
1515,Edward Henty settled Portland Bay in 1834 .,Edward Henty moved to Portland Bay and began sheep farming in December 1834 .
1516,The spring peeper ( Pseudacris crucifer ) is also widespread in the eastern United States and is commonly heard on summer and spring evenings .,The spring peeper ( Pseudacris crucifer ) can also be found in Eastern United States .
1517,"The practice of creating cardinal-nephews originated in the Middle Ages , and reached its apex during the 16th and 17th centuries .",The practice of creating cardinal-nephews originated in the Middle Ages .
1518,"In its modern usage , the term was first used by King Charles I of England in 1639 .",The term was first used by King Charles I of England in 1639 .
1519,"The scientific objectives were : Besides the experiments with the scientific instruments , the objectives of both the Mariner 1 and 2 probes included also engineering objectives : Mariner 2 was launched from Cape Canaveral Air Force Station Launch Complex 12 at 06:53:14 UTC on August 27 , 1962 by a two-stage Atlas-Agena rocket .","Mariner 2 was launched on August 27 , 1962 aboard an Atlas-Agena B rocket at Cape Canaveral Air Force Station ."
1520,"`` Diabolus in Musica '' was released on June 9 , 1998 by American Recordings .","`` Diabolus in Musica '' was released on June 9 , 1998 through American Recordings ."
1521,Tigny-Noyelle is a commune in the Pas-de-Calais department in the Nord-Pas-de-Calais region of France .,Tigny-Noyelle is a commune . It is found in the region Nord-Pas-de-Calais in the Pas-de-Calais department in the north of France .
1522,"Riverina soils are generally sandy along the river channels , with more saline grey and brown clays found on rarely flooded areas on the perimeter of the floodplain .","Riverina soils are generally sandy along the rivers , with more saline grey and brown clays found on rarely flooded areas on the edge of the floodplain ."
1523,"After the demise of Deep Purple , Coverdale embarked on a solo career .","After the end of Deep Purple , Coverdale started a solo career ."
1524,Beginning in a first competition in 486 BC each playwright submitted a comedy .,"From 486 BC , each playwright also submitted a comedy ."
1525,"In total , 1,010 707s were built for civil use , though many of these found their way to military service .","1,010 707s were made for airlines , but a lot of these went to militaries ."
1526,"Ramsay MacDonald became the first Labor Prime Minister , but the Labor government fell within months necessitating another general election .","In 1929 , the Conservatives lost the general election , and Ramsay MacDonald became the new Labor prime minister ."
1527,"Jones was the first artist signed to the NorthernBlues Music label in Toronto , Canada , and released his first six recordings with the label .",Jones was the first artist signed to the NorthernBlues Music label in Toronto .
1528,"As of February 2014 , McFly have had 18 consecutive UK top 20 singles , seven of which reached number one in the UK Singles Chart and seventeen of which were consecutive top ten singles .","By October 2007 , McFly had thirteen top ten singles ."
1529,She portrayed Carrie Buck in the television drama `` Against Her Will : The Carrie Buck Story '' ( 1994 ) based on the United States Supreme Court case `` Buck v. Bell '' 274 U.S. 200 ( 1927 ) .,"In 1994 , Matlin acted as Carrie Buck in `` Against Her Will : The Carrie Buck Story '' ( 1994 ) . This television movie is about the United States Supreme Court case `` Buck v. Bell '' 274 U.S. 200 ( 1927 ) ."
1530,"At the request of Premier Robert Bourassa , Prime Minister Pierre Trudeau invoked the War Measures Act .","Prime Minister Pierre Trudeau invoked the War Measures Act , and 497 people were arrested ."
1531,"A memorial plaque to McCarroll is located at the intersection of Indio Boulevard and Fargo Street in Indio , California .","A memorial plaque to Dr. McCarroll may be found at the intersection of Indio Boulevard and Flower Street in Indio , California ."
1532,"It was not until 1850 that zoologists realized the extant nature of the species , when Paul Gervais compared the type specimen to another that had stranded itself at Aresquiès , Hérault , in May of the same year , and found the two to be identical .","In 1850 zoologists realized the species was still living , when Paul Gervais compared the type specimen to a whale stranded at Aresquiès , Hérault . He found the two to be identical ."
1533,"Walker , the son of Cheryl ( née Crabtree ) , a fashion model , and Paul William Walker III , a sewer contractor and a fighter who was a two-time Golden Gloves champion , was born in Glendale , California .","His parents were Cheryl ( née Crabtree ) , a fashion model , and Paul William Walker III , a sewer contractor and a fighter who was a two-time Golden Gloves champion , He had English ancestry , with a smaller amount of German , and possible Irish ancestry ."
1534,The Province of Grosseto ( ) is a province in the Tuscany region of Italy .,Province of Grosseto ( Italian : `` Provincia di Grosseto '' ) is a province in the Tuscany region of Italy .
1535,Kapfenberger SV is an Austrian association football club from Kapfenberg .,"The Kapfenberger SV ( official Kapfenberger Sportvereinigung Superfund ) is a football club from Kapfenberg , Styria ."
1536,"On September 19 1846 , Maximin Giraud and Melanie Calvat ( called Mathieu ) reported seeing the Virgin Mary on Mount Sous-Les Baisses , weeping bitterly .","On 19 September 1846 , Maximin Giraud and Melanie Calvat reported seeing the Virgin Mary weeping on Mount Sous-les Baisses ."
1537,"After her death , she was hailed as `` one of the finest and most neglected singers of her time . ''","After her death , people called her one of the finest and most neglected singers of her time ."
1538,"However , OCA2 gene polymorphism , close to proximal 5 ′ regulatory region , explains most human eye-color variation .",OCA2 mutations close to the 5 ′ regulatory region explain most human eye-color variation .
1539,"On July 1 , 2014 , Aulie signed as a free agent to a one-year contract with the Edmonton Oilers .","On July 1 , 2014 , Aulie signed a one-year contract with the Edmonton Oilers ."
1540,"Benjamin `` Bugsy '' Siegel ( February 28 , 1906 -- June 20 , 1947 ) was a Jewish American mobster .","Benjamin Siegel ( February 28 , 1906 -- June 20 , 1947 ) was an American mobster with the Luciano crime family ."
1541,Roussent is a commune in the Pas-de-Calais department in the Nord-Pas-de-Calais region of France .,Roussent is a commune . It is found in the region Nord-Pas-de-Calais in the Pas-de-Calais department in the north of France .
1542,`` I 'm Your Baby Tonight '' is the lead single and title track from Whitney Houston 's third studio album of the same name .,`` I 'm Your Baby Tonight '' was the lead single and title track from Whitney Houston 's album of the same name .
1543,"In computing , the colon character is represented by ASCII code 58 , ( HTML &#58; ) and is located at Unicode code-point U +003 A ( colon ) .","In computing , the colon character is represented by ASCII code 58 , and is located at Unicode code-point U +003 A ."
1544,A 13-year-old boy that Jackson had befriended named Gavin Arvizo accused him of sexual abuse .,A 13-year-old boy called Gavin Arvizo accused him of sexual abuse in 2003 .
1545,As with `` terrorism '' the concept of `` state terrorism '' is controversial .,The concept of terrorism may be controversial .
1546,"A combustor is a component or area of a gas turbine , ramjet , or scramjet engine where combustion takes place .","A combustor is a part or area of a gas turbine , ramjet , or scramjet engine where combustion takes place ."
1547,"Paulo Henrique Souza de Oliveira ( born 5 January 1943 in Macaé ) , usually called Paulo Henrique , is a former Brazilian footballer .","Paulo Henrique Souza de Oliveira ( born 5 January , 1943 ) is a former Brazilian football player ."
1548,David Bala was a Singaporean comedian and actor .,David Bala ( 1947 -- 29 August 2014 ) was a Singaporean comedian and actor .
