,#1 String,#2 String
2319,"The fruit has a juicy , sweet seed pulp and slightly gritty flesh nearer the skin .","The fruits have a juicy sweet seed pulp , and slightly gritty flesh nearer the skin ."
2320,"On May 17 , 2012 , Boeing announced a further modification to the fan diameter with an increase to 69.4 inches ( 176 cm ) .",This means it is now 69.4 inches ( 176 cm ) .
2321,It is also called `` anthropophagy '' .,It is also called anthropophagy .
2322,"Although the WHA was not the first league since that time to attempt to challenge the NHL 's supremacy , it was by far the most successful in the modern era .","Although the WHA was not the first league since that time to attempt to challenge the NHL 's hold as the top league , it was by far the most successful ."
2323,Ludovic Magnin ( born 20 April 1979 in Lausanne ) is a former Swiss football defender .,Ludovic Magnin ( born 20 April 1979 ) is a Swiss football player .
2324,Pepin County was the birthplace of Laura Ingalls Wilder .,Laura Ingalls Wilder was born in Pepin County .
2325,"Kathleen Thompson Norris ( July 16 , 1880 -- January 18 , 1966 ) was a popular American novelist and newspaper columnist .","Kathleen Norris ( July 16 , 1880 -- January 18 , 1966 ) was an American newspaper columnist and novelist ."
2326,The term `` Applied Behavior Analysis '' ( ABA ) first came to widespread use after the 1968 introduction of The Journal of Applied Behavior Analysis which publishes research examining the application of behavior analysis to socially-relevant behavior .,Applied behavior analysis ( ABA ) is a way to help some people change their behavior .
2327,"The hind legs are short relative to other frogs ' legs and the hind feet have long , unwebbed toes .","The back legs are short and the back feet have long , unwebbed toes ."
2328,"At the death of her brother , Louis Alexandre de Bourbon-Penthièvre , prince de Lamballe , she became the wealthiest heiress in France prior to the French Revolution .","At the death of her brother , Louis Alexandre de Bourbon , prince de Lamballe , she became the wealthiest heiress in France ."
2329,"The journal publishes editorials , original articles , case reports , and letters .","The journal publishes editorials , articles , case reports , and letters ."
2330,Wuthering Heights is Emily Brontë 's only novel .,Wuthering Heights is a novel by Emily Brontë .
2331,"England has no official anthem and uses the British national anthem `` God Save the Queen '' , also unofficial , for some national occasions , such as before English international football matches .","England ( as distinct from Britain ) does not have an official anthem and so the British National Anthem `` God Save the Queen '' is used for national occasions , for example before English international football matches or at the Last Night of the Proms ."
2332,"In their most usual implementation , each user applies to a ` certificate authority ' for a digital certificate which serves for other users as a non-tamperable authentication of identity , at the risk of compromising every user in case the CA itself is compromised .","In their most usual implementation , each user applies to a `` certificate authority '' for a digital certificate which serves for other users as a correct ( termed : non-tamperable ) authentication of identity ."
2333,"Nickelodeon promoted many episodes such as `` iDo '' , `` iHire an Idiot '' , `` iPity the Nevel '' , `` iDate Sam & Freddie '' , etc. as specials , despite their being regular episodes .","Nickelodeon promoted many episodes so far such as `` iDo '' , `` iHire an Idiot '' , `` iPity the Nevel '' , `` iDate Sam & Freddie '' , etc. as specials , despite them being regular episodes ."
2334,Toivakka is a municipality of Finland .,Toivakka is a municipality in Central Finland .
2335,"Ryan Shay ( May 4 , 1979 -- November 3 , 2007 ) was an American professional long-distance runner .","Ryan Shay , born May 4 , 1979 -- dead 3 November 3 , 2007 was an US professional long-distance runner ."
2336,"In 1995 , Suarez and Sordo showed that sulfur dioxide when reacted with butadiene and isoprene gives two different products depending on the mechanism .","When sulfur dioxide reacts with butadiene and isoprene , two different products result ."
2337,The kea ( ; ; `` Nestor notabilis '' ) is a large species of parrot of the superfamily Strigopoidea found in forested and alpine regions of the South Island of New Zealand .,The Kea ( `` Nestor notabilis '' ) is a large species of parrot found in forested and alpine regions of the South Island of New Zealand .
2338,"It has existed since 1965 , being the successor to the British West Indies dollar , and it is normally abbreviated with the dollar sign `` $ '' or , alternatively , `` EC$ '' to distinguish it from other dollar-denominated currencies .","It has existed since 1965 , when it replaced the British West Indies dollar , and it is normally abbreviated with the dollar sign `` $ '' or , alternatively , `` EC$ '' to distinguish it from other dollar-denominated currencies ."
2339,"Destiny Fulfilled is the fourth and final studio album by American R&B trio Destiny 's Child , released on November 10 , 2004 .",Destiny Fulfilled is the fourth studio album by the American R&B trio Destiny 's Child .
2340,"Bush suffers from Vascular Parkinsonism , a form of Parkinson 's disease which has forced him to use a motorized scooter or wheelchair since at least 2012 .","Bush suffers from a form of Parkinson 's disease which has forced him to use a motorized scooter or wheelchair to get around , since at least 2012 ."
2341,By late February-early March it is followed up by the Swedish national championship playoff .,It is followed up by the Swedish national championship playoff by late February-early March .
2342,"Fans gave Koivu an eight-minute standing ovation when he skated onto the Molson Centre ice for the first time on April 9 , 2002 , in the team 's 80th game of the season .","The fans gave Koivu an eight-minute standing ovation when he skated onto the Molson Centre ice for the first time on April 9 , 2002 ."
2343,"Sergei Eisenstein 's famous motion picture The Battleship Potemkin commemorated the uprising and included a scene where hundreds of Odessan citizens were murdered on the great stone staircase ( now popularly known as the `` Potemkin Steps '' ) , in one of the most famous scenes in motion picture history .","Sergei Eisenstein 's famous motion picture The Battleship Potemkin commemorated the uprising and included a scene where hundreds of Odessan citizens were killed on the great stone staircase ( now popularly known as the `` Potemkin Steps '' ) , in one of the most famous scenes in motion picture history ."
2344,"On 20 April , Hitler 's birthday , Soviet artillery of the 1st Belorussian Front began shelling Berlin and did not stop until the city surrendered .",They did not stop until the city surrendered .
2345,"The university is often referred to as the Sorbonne after its collegiate institution , Collège de Sorbonne , founded around 1257 by Robert de Sorbon .","The university is often referred to as the Sorbonne or la Sorbonne , after the creation of the college ( Collège de Sorbonne ) founded around 1257 by Robert de Sorbon ."
2346,"Here is Berg 's tone row : Although this contains all twelve notes of the chromatic scale , there is a strong tonal undercurrent : the first three notes of the row make up a G minor triad ; notes three to five are a D major triad ; notes five to seven are an A minor triad ; notes seven to nine are an E major triad ; and the last four notes ( B , C ♯ , E ♭ , F ) and the first ( G ) together make up part of a whole tone scale .",This is because the first three notes are a G minor triad ; notes three to five are a D major triad ; notes five to seven are an A minor triad ; notes seven to nine are an E major triad ; and the last four notes together make up part of a whole tone scale .
2347,"He was the 2009 champion of the GP2 Series , and is a previous champion of both the Formula 3 Euro Series and A1 Grand Prix , as part of A1 Team Germany .","He won the 2009 GP2 Series championship . He is a past champion in Formula Three Euroseries and the A1 Grand Prix , as part of A1 Team Germany ."
2348,"Where more than one player won his first Test cap in the same Test match , those players are listed alphabetically by surname . Players .","Where more than one player won his first Test cap in the same Test match , those players are listed alphabetically by surname ."
2349,The residents of the household do not have to be related to the head of the household for their earnings to be considered part of the household 's income .,The residents of the household do not have to be related to the householder for their earnings to be considered part of the household 's income .
2350,"In `` Open Season '' and `` Boog and Elliot 's Midnight Bun Run '' , Tootoosis was the voice of Sheriff Gordy .","In `` Open Season '' ( 2006 ) , he voiced Sheriff Gordy . He played the same role in `` Boog and Elliot 's Midnight Bun Run '' ( 2006 ) ."
2351,"Morphogenesis ( from the Greek `` morphê '' shape and `` genesis '' creation , literally , `` beginning of the shape '' ) is the biological process that causes an organism to develop its shape .","Morphogenesis ( meaning the `` beginning of shape '' ) , is the biological process that causes an organism to develop its shape ."
2352,"Virginia Sports Hall of Fame . In 2004 , he was inducted into the Virginia Sports Hall of Fame .","In 2004 , he was added into the Virginia Sports Hall of Fame ."
2353,"By this time , she functioned as a doctor in natural medicine and made her living visiting and nursing people .",She often visited sick people and worked as a doctor in natural medicine .
2354,"U.S. wind power installed capacity now exceeds 60,000 MW and supplies 4 % of the nation 's electricity .","Latest American Wind Energy Association figures show that installed U.S. wind power capacity now exceeds 11,600 MW which is enough to serve three million average households ."
2355,"Chytridiomycosis , an infectious disease of amphibians , has been reported in common toads in Spain and the United Kingdom and may affect some populations .","Chytridiomycosis , an infectious disease of amphibians , has been reported in common toads in Spain and the United Kingdom . This may affect some populations ."
2356,"Paramore began recording their second album , Riot !","Paramore started recording their second album , called Riot !"
2357,"The diary was retrieved by Miep Gies , who gave it to Anne 's father , Otto Frank , the only known survivor of the family .","After the war , the diary was found by Anne 's father , Otto Frank ."
2358,Many if not all of these family members are involved in institutionalised philanthropic pursuits .,Many if not all of these family members are involved in institutionalized philanthropic pursuits .
2359,"A U.S. study by Alfred Kinsey found that 75 % of the participants stated that there was never nudity in the home when they were growing up , 5 % of the participants said that there was `` seldom '' nudity in the home , 3 % said `` often '' , and 17 % said that it was `` usual '' .","A study by Alfred Kinsey found that 75 % of the participants stated that there was never nudity in the home when they were growing up , 5 % of them said that there was `` seldom '' nudity in the home , 3 % said `` often '' , and 17 % said that it was `` usual '' ."
2360,In 1929 it was decided to increase the headroom to 16 feet 6 inches ( 5.03 m ) .,"In 1929 , it was then decided that the headroom of the tunnel would be increased to 16 feet 6 inches ( 5.03 m ) ."
2361,"Kensuke Kagami ( 加賀見 健介 , born 21 November 1974 ) is a former Japanese football player .",Kensuke Kagami ( born 21 November 1974 ) is a former Japanese football player .
2362,The many orchards in the canton are mainly used for the production of cider .,The many orchards in the canton are used for the making of cider .
2363,"According to `` Kojiki '' and `` Nihon Shoki '' , Ankō was the second son of Emperor Ingyō .",The `` Kojiki '' and `` Nihon Shoki '' record that Ankō was the second son of Emperor Ingyō .
2364,"Additionally , the Fenty administration improved the delivery of emergency medical services and expanded health care coverage for the uninsured .","Additionally , the Fenty Administration has improved the delivery of emergency medical services ."
2365,"Harry Potter and the Half-Blood Prince is the sixth and penultimate novel in the Harry Potter series , written by British author J. K. Rowling .",Harry Potter and the Half-Blood Prince was written by J. K. Rowling and published on 16 July 2005 .
2366,It is the final album by Good Charlotte to be released through Daylight Records ; they subsequently signed a deal with Capitol .,It was the last album to be released on the Daylight Records due to Good Charlotte signing with Capitol Records .
2367,"Nuremberg for many people is still associated with its traditional gingerbread ( `` Lebkuchen '' ) products , sausages , and handmade toys .","Nuremberg is still associated with gingerbread ( `` Lebkuchen '' ) products , sausages , and handmade toys ."
2368,"Having completed his studies , he trained for some time as an advocate , but he preferred teaching .","Having completed his studies , he trained for some time as a lawyer , but he preferred teaching ."
2369,"She was a popular writer in her time , and her work has received increasing attention from literary critics in recent years .","A popular writer in her time , her work has received even more attention from literary critics in recent years ."
2370,"Marguerite Louise d'Orléans , a granddaughter of Henry IV of France , was married to Cosimo by proxy on 17 April 1661 at the Palais du Louvre .","Cosimo III had three children with Marguerite Louise d'Orléans , a granddaughter of Henry IV of France :"
2371,The character became a notable part of American popular culture in the 1950s .,The character became a big part of American popular culture in the 1950s .
2372,"Two weeks later , on April 18 , after a Canada-wide search , Blight was found dead in a field on his farm near Lake Manitoba , with his pickup nearby .","After two weeks and a Canada-wide search , his body was found dead in a field on his farm near Lake Manitoba with his pickup nearby ."
2373,"The term comes from the Latin `` decanus '' , `` a leader of ten '' , taken from the medieval monasteries ( particularly those following the Cluniac Reforms ) which were often extremely large , with hundreds of monks ( the size of a small college campus ) .","The term comes from the Latin `` decanus '' , a leader of `` ten , '' taken from the medieval monasteries ( particularly those following the Cluniac Reforms ) which were often extremely large , with hundreds of monks ( the size of a small college campus ) ."
2374,"Jaime Bayly Letts ( born February 19 , 1965 ) is a Peruvian writer , journalist and television personality .","Jaime Bayly Letts ( born February 19 , 1965 ) is a Peruvian writer and journalist ."
2375,", rock , red , quick , run , expect '' ) , or several ( `` rocks , redness , quickly , running , unexpected '' ) , whereas a morpheme may not be able to stand on its own as a word ( in the words just mentioned , these are '' - s , - ness , - ly , - ing , un - , - ed '' ) .",", rock , red , quick , run , expect '' ) , or several ( `` rocks , redness , quickly , running , unexpected '' ) , whereas a morpheme may not be able to stand on its own as a word ( in the words just given , these are '' - s , - ness , - ly , - ing , un - , - ed '' ) ."
2376,In 973 Geoffrey had married his daughter Ermengarde-Gerberga to Conan I of Rennes but Conan began to oppose Geoffrey and in 982 the two met at the first battle of Conquereuil with Geoffrey defeating Conan .,In 982 the two met at the first battle of Conquereuil where Geoffrey defeated Conan .
2377,"The film was released on VHS and DVD on February 4 , 2003 .","The movie was released on VHS and DVD on December 3 , 2002 ."
2378,A lightning rod is a single component in a lightning protection system .,It is part of a lightning protection system .
2379,"The name was changed from `` Spotted Mist '' to `` Australian Mist '' in 1998 , when cats with marbled coats , rather than spots , were accepted as part of the breed .","In 1998 , the name was changed to `` Australian Mist '' , when cats with marbled coats became part of the breed ."
2380,"After receiving his commission , Robinson was reassigned to Fort Hood , Texas , where he joined the 761st `` Black Panthers '' Tank Battalion .","After receiving his commission , Robinson was moved to Fort Hood , Texas . There he joined the 761st `` Black Panthers '' Tank Battalion ."
2381,"Notable exceptions include De La Salle University & Far Eastern University - East Asia College , which follow the 1.000 - 4.000 grading system patterned after American universities .","Notable exceptions include De La Salle University & FEU-East Asia College , which follow the 1.000 - 4.000 grading system , which patterns those of American universities ."
2382,The park is ranked as one of the most significant arid land ecosystems in the world .,The park is ranked as one of the most important arid land [ [ ecosystem ] ] s in the world .
2383,Beatrix Potter 's `` The Tale of Peter Rabbit '' was published in 1902 to immediate success .,Beatrix Potter 's `` The Tale of Peter Rabbit '' was published in 1902 .
2384,"The incident was the largest mass murder in Canadian history , .","The bombing was called the largest mass murder in modern Canadian history , and the deadliest act of air terrorism before 9\/11 ."
2385,The couscous that is sold in most Western supermarkets has been pre-steamed and dried ; the package directions usually instruct to add 1.5 measures of `` boiling '' water or stock and butter to each measure of couscous and to cover tightly for 5 minutes .,The couscous that is sold in most Western supermarkets has been pre-steamed and dried ; the package directions are usually to add 1.5 measures of `` boiling '' water or stock and butter to each measure of couscous and to cover tightly for five minutes .
2386,"In law , the payer is the party making a payment while the payee is the party receiving the payment .","In law , the `` payer '' is the party that sends the payment and the `` payee '' is the party that gets the payment ."
2387,"A particular blind spot known as the blind spot , physiological blind spot , `` blind point '' , or punctum caecum in medical literature , is the place in the visual field that corresponds to the lack of light-detecting photoreceptor cells on the optic disc of the retina where the optic nerve passes through the optic disc .",It is the place in the visual field that corresponds to the lack of light-detecting photoreceptor cells where the optic nerve passes through the optic disc of the retina .
2388,"Let a piece of glass and a piece of resin , neither of which exhibiting any electrical properties , be rubbed together and left with the rubbed surfaces in contact .",Let a piece of glass and a piece of resin-neither of which exhibits any electrical properties-be rubbed together and left with the rubbed surfaces in contact .
2389,"Mega Man , known as in Japan , is an action-platform video game developed and published by Capcom for the Nintendo Entertainment System ( NES ) .",in Japan . It is a video game developed and published by Capcom for the Nintendo Entertainment System ( NES ) .
2390,"He lived in West Bloomfield Township , north of Detroit , and died after a short illness in June 2014 , aged 75 .","He lived in West Bloomfield Township , north of Detroit . Davis died there after a short illness in June 2014 , aged 75 ."
2391,All German Navy submarines are stationed in Eckernförde .,All 24 German submarines are stationed in Eckernförde .
2392,"[ 1,7 ] sigmatropic shifts are predicted by the Woodward -- Hoffmann rules to proceed in an antarafacial fashion , via a Mobius topology transition state .","[ 1,7 ] sigmatropic shifts are predicted by the Woodward-Hoffmann rules to proceed in an antarafacial fashion , by a Mobius topology transition state ."
2393,German athletes have taken part in most of the Olympic Games since the first modern Games in 1896 .,German athletes have been a part of most of the Olympic Games since the first modern Games in 1896 .
2394,Additionally visceral disease can be diagnosed via blood tests .,The visceral form can be diagnosed with a blood test .
2395,"An affiliate of the New York Mets , the team has competed in the city since 1969 , with the exception of 1983 .","They are an affiliate of the New York Mets . The team has competed in the city since 1969 , with the exception of 1983 ."
2396,"Before official admission of white women to the University , several white women were able to complete graduate degrees through credit earned during the summer sessions .","Before official admission of women to the University , several women were able to complete graduate degrees through credit earned during the summer sessions ."
2397,"The 727 was designed for smaller airports , so independence from ground facilities was an important requirement .",The 727 was meant for small airports .
2398,"There are at least eight subspecies with little variation in appearance , although recent research has demonstrated significant genetic differences among populations from various regions .",There are at least eight subspecies with little variation in appearance -- although recent research has demonstrated significant genetic differences among populations from various regions .
2399,"The draft was held April 24-25 , 2004 at the theater at Madison Square Garden .",It was held at Madison Square Garden in New York on April 24 and 25 .
2400,A transcription by the English pianist Myra Hess ( 1890 -- 1965 ) was published in 1926 for piano solo and in 1934 for piano duet .,"A transcription of `` Jesu '' was made by the English pianist Myra Hess ( 1890 -- 1965 ) , It was published in 1926 for piano solo ."
2401,"Three of these pathways are important since they have been targeted with drugs - endothelin receptor antagonists , phosphodiesterase type 5 ( PDE-5 ) inhibitors , and prostacyclin derivatives .","These pathways correspond to important therapeutic targets in this condition and play a role in determining which of three classes of drugs - endothelin receptor antagonists , phosphodiesterase type 5 inhibitors , and prostacyclin derivatives - will be used ."
2402,"Arcadia is a town in and the parish seat of Bienville Parish in north Louisiana , United States .","Arcadia is a large town in Louisiana , United States . It is the parish seat of Bienville Parish ."
2403,"The new tower , or `` North Tower '' is a , 28-story addition , completed in 1961 .","The new tower , or `` North Tower '' is a 295 ft , 28-story addition , completed in 1961 ."
2404,"Baohe District ( ) is a district of Anhui Province , China .",Baohe is a district in the province of Anhui in China .
2405,The roe deer is distinct from the somewhat larger Siberian roe deer ( Capreolus pygargus ) that is found from the Ural Mountains to as far east as China and Siberia .,"It is also called European Roe Deer to not confuse it with the related Asian species , the Siberian Roe Deer ( Capreolus pygargus ) ."
2406,It is the first book in the Guardians of Time Trilogy .,It is the first book in the `` Guardians of Time Trilogy '' .
2407,"Blackburn is a large town in Lancashire , England .","Blackburn is a town in Lancashire , England ."
2408,"Incidents of violent crime is uncommon , but increasing .","Violent crime is uncommon , but increasing ."
2409,"In the course of the legal battle , Sompote presented photos of himself sharing his photos of Thai Buddhist edifices stating that Eiji had based Ultraman 's face on the said edifices , a claim which he has continued to hold since the dispute began .","In the course of the legal battle , Sompote presented photos of himself sharing his photos of Thai Buddhist stating that Eiji had based Ultraman 's face on the said structure , a claim which he has continued to hold since the dispute began ."
2410,"`` Morning Glory '' is a song by the English rock band Oasis , written by Noel Gallagher , and released on the band 's second album '' ( What 's the Story ) Morning Glory ? ''","`` Morning Glory '' is a song by the rock band Oasis . The song was written by Noel Gallagher , and which was released on the band 's second album ( What 's the Story ) Morning Glory ?"
2411,"In 1937 , he married Alice Faye , with whom he had appeared in several films .","In 1937 he married Alice Faye , with whom he had starred in several films ."
2412,Wheel gymnastics ( German : ) is a form of gymnastics that originated in Germany .,Wheel gymnastics is a form of gymnastics which originated in Germany .
2413,"It is located in the Upper Midwestern region of the United States , bordered by the Canadian provinces of Saskatchewan and Manitoba to the north , the states of Minnesota to the east , South Dakota to the south , and Montana to the west .","Montana , South Dakota , and Minnesota are other states in the United States ."
2414,"The island was named after Midshipman Robert Pitcairn , a fifteen-year-old crew member who was the first to sight the island .","The island was named after Robert Pitcairn , a 15 year old midshipman who was the first person on the Swallow to see it ."
