,#1 String,#2 String
251,A man with a bright green shirt is talking to a woman in a pink shirt.,A couple is talking.
252,A man in a green shirt holds out a clipboard for a woman in pink's attention.,A man wants a woman to look at his clipboard
253,A man in a bright green shirt shows a woman in a bright pink shirt something on a clipboard.,A man shows a woman something.
254,A man on a street in a bright t-shirt holds some sort of tablet towards a woman in a pink t-shirt and shades.,The man and woman are outdoors.
255,A child with a yellow cup and milk all over his face.,The child had milk all over his face.
256,Two barefoot men are playing on a green lawn outside a building with other people in the background.,Two men are barefoot on the lawn.
257,Small laughing child with blond-hair sitting at a table holding a green sippy cup.,The child is happy.
258,A little boy drinks milk and gets milk all over his face and table.,the kid has milk on his face
259,Two pre-teen girls listening to music on an MP3 player with headphones.,Thre are girls.
260,A man is running behind a dogsled being pulled by four dogs.,A man is running  behind a sled.
261,Toddler with milk around his mouth.,A child has milk on their face.
262,A man dressed in warm clothing sleds behind four dogs in the snow.,The man is outside sledding.
263,A cowboy Roping a calf in a rodeo.,A person is performing.
264,Men fish on a concrete slab.,Men are near the water.
265,A man wearing a blue shirt screaming or yelling with his arms raised up in the air.,A man makes a ruckus.
266,"Four people near a body of water, one sitting and three standing, while two people walk on a nearby sidewalk.",one person sits while three stand near a body of water.
267,Two little girls lie on the carpet next to an O made of wooden blocks.,Two girls lay next to wooden blocks.
268,People are fishing and walking next to the water.,People are fishing and walking next to the water.
269,Two guys playing football on a campus green.,There are some guys in this picture
270,Asian school children sitting on each others shoulders.,Schoolchildren together
271,A man wearing a red sweater is sitting on a car bumper watching another person work.,there was a speed breaker on the road by which people are taking care
272,A young woman frolicking on the lawn in front of the us capitol building.,A young lady playing in front of the capitol building.
273,a man wearing a multicolored striped shirt playing the guitar on the street,A man in a colorful shirt is playing an instrument.
274,A man wearing a colorful and striped sweater plays music in the street.,The man is playing music on an instrument.
275,A man wearing a multi-color coat is playing the guitar on the street.,The man plays guitar
276,Street performer in colorful shirt performing with small guitar.,A street performer is trying to earn extra money.
277,Two men are painting a building while a third is walking past on his cellphone.,A building is being painted.
278,Two men are on scaffolding as they paint above a storefront while a man on the sidewalk stands next to them talking on the phone.,Three men are outside.
279,A blue excavator digging a large hold in cement.,a child was there
280,A man with khaki shorts on is holding a little girls hand while she walks in the water of a creek.,A man is holding a girls hand and walking through a creek.
281,Two women are walking down a dirt path carrying loads on their heads.,Two people are walking down a path.
282,A street vendor in Asia tries to bring in more customers.,A vendor trying to attract costumers.
283,Young woman in a cafe checking her cellphone.,A woman is inside.
284,A woman and a girl are playing in a field of leaves,Two people are outside.
285,two small girls walk along the leaves.,The two girls are outside.
286,"A girl wearing a blue shirt, shorts, and sneakers is seated on a stool at a round table, looking at her phone.",The girl is sitting.
287,Young lady dressed in black shorts and light blue shirt sitting outside at a public table looking at a picture on her camera with her left hand on her face.,A young lady is looking at a picture.
288,"A woman sitting at a table, taking a picture.",THe woman is sitting down
289,A woman in a blue shirt is sitting at a table and looking at her cellphone.,a woman looking at her cellphone
290,"A boy in a blue, yellow, and orange shirt holding his arms out from his sides.",The boy is wearing a shirt.
291,The boy in the blue and yellow top is standing with arms outstretched.,A boy is wearing a shirt
292,"A boy in a blue, yellow, and orange shirt plays outside.",A boy in a shirt plays outside.
293,A child with a brightly colored shirt plays outside.,The child is outdoors in his bright colored shirt.
294,A boy looks down and spreads his arms wide,A boy is holding his arms out.
295,A man wearing a gray sweater walking through a pile of leaves.,The man is outside.
296,A lady wearing a blue print shirt and green head cover smiles for the camera.,A lady wearing a blue shirt.
297,The man wearing lots of medals is watching the girl in the yellow bikini top.,A decorated man sees a scantily clad female.
298,"A young man in his mid twenties is kicking his left foot about two feet off the leaf covered ground, with paved asphalt and green plants and trees in the background.",someone in his twenties kicks at the ground
299,A woman wearing a green headscarf laughs while a woman in the background paddles a boat.,A woman laughs while another paddles a boat.
300,Young people playing with a long jump rope in the street.,People playing jump rope.
301,A group of children play jump rope in the streets while others watch in the background.,Several children are jumping rope in the middle of a road while other kids watch
302,Hispanic woman wearing a red plaid shirt works on sewing an article of clothing.,Woman wearing a shirt sewing.
303,A group of young girls playing jump rope in the street.,Humans playing jump rope
304,A man in a tan suit is using a pay phone to make a call.,Someone is on a phone.
305,Some children are playing jump rope.,Children are jumping rope.
306,A large golden dog sniffing the butt of a white dog,Two animals getting to know each other.
307,A sumo wrestler with a brown belt is pushing another wrestler in a bout.,Two sumo wrestlers compete in a match.
308,Two large dogs greet other while their owners watch.,the dogs see each other
309,"A man in a red and black jacket, blue shirt, lots of silver necklaces, and his blue jeans falling down, checks out a woman wearing a black leather jacket, yellow bra, pink fingerless gloves, and sunglasses.",A man is wearing many silver necklaces.
310,Woman with green sweater and sunglasses smiling,A woman with a green sweater has a happy expression.
311,A woman with dark hair is wearing a green sweater.,A woman is there.
312,A smiling lady in a green jacket at a public gathering.,A happy woman smiling
313,A woman in a green jacket and black sunglasses outside in a crowd.,A woman is outside.
314,A lady with sunglasses on her head and a green sweatshirt is looking off-camera.,A woman is wearing a green sweatshirt.
315,A climber is making his way up a snowy mountainside.,A climber is ascending
316,A man dressed in snow-gear takes a leap into a snow-covered ravine.,A man is outdoors.
317,a lone person jumping through the air from one snowy mountain to another.,A person jumps in the air.
318,A man in shorts and a white garment stands at the base of stairs framed by black railing.,A man stands at the bottom of the stairs.
319,A man doing tricks in the snow.,The man is outside.
320,Two Asian people sit at a blue table in a food court.,Two people are seated together.
321,Indian couple holding child near riverbank.,A couple is holding a child
322,A bunch of people playing soccer.,a bunch of people are playing soccer
323,A soccer player jumping in air during a game.,A soccer player jumping up while a game is in progess.
324,A shot-on-goal action photo of soccer players in red and black uniforms.,a player has a penalty kick
325,The red team knocked the ball toward the goal and the black team tried to block it.,The red and black team are playing a game.
326,Six soccer players on field with player in red uniform in the air and ball airborne.,People are playing soccer.
327,Two little kids showing their American pride in their star spangled wagon.,Two kids are with a wagon.
328,"A young man in a red quilted vest displays an assortment of silver pendants around his neck as he watches a woman in a yellow bikini top, a black jacket, and bright pink fingerless gloves go by.",Someone is browsing jewelry.
329,Girl is blowing to a butterfly.,The girl blows a butterfly.
330,An elderly couple dances next to a table where a boy is sitting with his head down.,A young man has his head on the table.
331,A small girl stands among many large watermelons.,There is a girl standing
332,An elderly couple dance in front of a juke box while a guy in shorts sleeps at a nearby table,An old couple dance in by a juke box while a dude wearing shorts sleeps near a table
333,"An elderly couple, both wearing white shirts, dancing and a young male sitting at a table.",The couple is dancing together.
334,A child stoops to pick up a watermelon from a large pile of them.,A person is near a watermelon.
335,A small girl dressed in a yellow dress with flowers on it bends over near a large pile of watermelons.,The girl is under the age of 88 years old.
336,A little girl picking up a watermelon from a pile.,A girl is picking an item up.
337,a young girl in a flowery dress surrounded by watermelons,There is a lot of fruit.
338,A man in a blue jacket screaming.,A man is making a loud noise.
339,Children playing a game in a field.,Children playing a game.
340,A seated woman with short hair and a camera throws a Frisbee to a brown dog.,The woman throws a Frisbee to the dog.
341,Asian city scene of people in street with bright lights and glass buildings behind.,City people in street
342,A man is painting a portrait of an outside scene that includes a street sign with a bicycle chained to it.,A man is painting a landscape of an outdoors area.
343,An older man stands on the sidewalk painting the view.,The old man is painting a portrait.
344,"A crowded street, in an Asian country, where the buildings are dominated by the Seiko building.",The Seiko building is large.
345,A small boy has gotten into the cabinet and gotten flour and crisco all over himself.,The boy is making a mess.
346,A male painting a scene in front of him.,A person is painting.
347,Busy Japanese intersection like maybe Tokyo.,There are lots of cars on the street.
348,Cars are passing through a town.,some car passing outside
349,A picture of a city with a sign welcoming travelers on a busy street.,A picture of a city is on a street
350,Overlooking a street with a sign above shops that states Welcome To Golden.,"The shop sign says  ""Welcome to Golden"""
351,There are cars driving down a street with a sign displaying Welcome to Golden.,The cars are outside.
352,"A main street scene of a small town with an overhead welcome sign that says ""Welcome to Golden"".","A sign reads ""Welcome to Golden"""
353,Little Girl in brown shirt and blue jean skirt dances on wood floor.,A girl is dancing in a brown shirt and blue jean skirt on a wooden floor
354,A young man is performing a jump on a skateboard while another young man photographs his stunt.,Two boys are skateboarding outside.
355,A young girl dancing in her socks on a wooden floor strewn with pink balloons.,A girl is enjoying herself.
356,"Child with pink strings on head dancing surrounded by confetti, balloons.",A child is dancing.
357,"A good-looking firefighter sets up ""Do Not Cross"" tape in the city.",A firefighter sets up a do not cross
358,A fireman protects an area by setting up a boundary while others watch.,A fireman is working hard to keep people safe.
359,The blond girl is dancing inside a house.,A person is indoors.
360,"Two people standing in front of a large statue of a woman, other statues and busts visible in the background.","Two people standing standing near a large statue, with other states nearby."
361,a man with a white covering is walking up a flight of stairs.,A human walks up some stairs.
362,A family between a van and fence,A family by a van.
363,A woman talking to four little children outside.,A female adult is near some kids.
364,A mother with her four children.,A woman with children.
365,A woman and a few children in an alleyway in between a vehicle and a fence.,Several people in an alleyway.
366,A woman in a floral dress talks to children in front of a van.,A woman is talking to children.
367,Two men with heads down signing a paper.,The two men sign something.
368,A man and a woman having an intimate conversation in front a statue.,A couple are having a conversation
369,A man in a Tour De Force shirt is working on a bicycle.,A man is working on a bike.
370,A young toddler wearing pink sandals is walking on hopscotch numbers.,A baby walks on the ground.
371,a man wearing blue plays soccer.,man playing soccer
372,Mothers with children talking at a gathering.,The mothers are having conversations.
373,Two women are talking while children are sitting on their laps.,Some women are talking.
374,"Two women, each embracing a little girl, catch up at a small family gathering.",2 women are carrying little girls.
375,Two women holding children talking to one another.,There are at least four people.
376,"Two women, each with a child, look at each other.",Women are with their kids
377,A black-and-white dog carries a stick in his mouth as he swims in the clear water.,A dog is outside
378,A black and white dog with a stick in its mouth is swimming.,A dog with an object in it's mouth is in the water.
379,A pirate is chasing a princess down the sidewalk.,Pirate on the sidewalk
380,A dog is fetching a stick out of very clear water.,A dog is fetching a stick out of very clear water.
381,A dog in the water carries a stick in his mouth.,A dog carries a stick in his mouth.
382,Two children are running down a sidewalk dressed in costumes.,Two kids are running.
383,1 little boy wearing a pirate costume following closely behind a little girl wearing a blue dress carrying a orange pumpkin bucket and walking down the sidewalk.,Boy in costume followed by a girl in costume.
384,A little boy in a pirate costume is running behind a little girl in a princess costume carrying an orange pumpkin along the sidewalk.,Two kids wearing costumes are outside.
385,A man with a gray shirt holds a young infant in his hands.,A man is wearing a shirt.
386,"Two girls, each in a dress walking together.",Two Girls are doing exercise.
387,A group of people are sitting around a table under a blue sunshade.,people sit around table
388,People in line for plates of rice.,People are waiting to eat.
389,People sitting down to eat.,People are about to eat.
390,Several men sit outside on brick ledges built around tall trees.,Some men are sitting outdoors.
391,Workers are eating a meal while one man sits on a pile of plywood.,Workers are resting during a meal break.
392,Workers are taking a break during midday.,Workers are on break.
393,Workers are sitting next to a work zone eating food.,the workers are waiting for next work
394,Biker riding dirt bike on dirt track,Human rides two wheeled vehicle.
395,A motorcycle racer is in action at the track.,The racer is driving.
396,A blond woman with her hair up is taking off a white sweatshirt.,A woman is blonde
397,A person is a red hat and winter jacket is looking into the distance.,The person stares off into the distance.
398,A man riding a dirt bike,A man is outside.
399,"A man is sitting with his head facing down, while other people are looking in his direction.",The man is being stared at.
400,Small blond-haired girl drinking a glass of juice.,A girl is holding a glass.
401,A person in a red coat and a running black and brown dog.,A person in a red dress is running behind a black animal.
402,a woman in a red jacket watches as a black and brown dog runs away from her in woodland clearing.,A woman is wearing a red jacket
403,"Outside by the trees, a woman wearing jeans and red jacket throws something for a German shepherd to chase.",A woman throws something for a dog.
404,A dog is preparing to run away from a person interacting with it.,A dog is nearby a person
405,A woman in a black and orange jacket throws a stick for a brown and black dog to fetch.,A woman is interacting with a dog.
406,"Two men trying to build something together, while having fun.",Two men are laughing and enjoying themselves.
407,Three people are sitting on a bench.,There are people sitting down.
408,Two women and one man sit on a bench.,The women and the man are on a bench.
409,A man and two women sitting on a bench.,A few people share a bench.
410,A man and two women in black jackets holding umbrellas sit on a long wooden bench.,People are on a bench
411,man in red canada shirt standing with three men in army uniform,Man standing with three men in army uniform
412,Skydivers in formation.,People are skydiving.
413,A woman checks her purse while at a outside cafe.,A person looks in her purse at a restaurant.
414,The cowboy waves to the rodeo crowd.,The cowboy waved to the crowd.
415,A woman is sitting at an outdoor dining table.,A person is sitting down.
416,Lady wearing a yellow top is sitting on a chair,A woman with a yellow to sits.
417,a child is pushing another kid in a wheeler dressed in a red top and wearing a cap.,Children enjoy playing together.
418,A cowboy is riding a bucking bull in a rodeo arena.,A cowboy rides a bull at a rodeo.
419,A blond child is pulling a wagon with a little blond boy in it.,A child is pulling a toy wagon.
420,A man wearing a tan coat signs papers for another man wearing a blue coat.,"One man writes on papers, while another man stands by."
421,A groom and a bride are standing on the grass with his hand on her waist.,A groom and bride are standing outside.
422,A man is singing into a microphone.,A man sings a song.
423,a girl wearing a blue and pink swimsuit is throwing stones into a lake.,girl throws stones
424,"A man and a woman being intimate, with their legs in the water.",a man and woman are getting intimate
425,A group of people stand on a grassy field.,People are standing on a grassy field
426,Men in uniform work together.,Uniformed men work.
427,An elderly woman places carrots into a casserole.,An elderly woman puts carrots into a casserole
428,A man in a gray vehicle feeding sheep.,The man is outside.
429,"Three men are grouped around the back of a car with its tailgate out, two of the men clothed in yellow uniforms and one in blue.",Three men are grouped around the back of a car.
430,"Three men, two wearing yellow suits, are looking in the back of a car.",Three men looking at a car.
431,Emergency personnel looking into the back of a car.,People are looking in a car.
432,Some firefighters check a vehicle.,Firefighters are checking a car.
433,A man in a kitchen is frying breaded food in a cast iron pan.,A man cooks.
434,A woman in colorful garb with her back to the camera and cloth on her hear.,A woman has her back to the camera.
435,A woman in colorful native attire featuring a blue shirt with a colorful design displays her dark hair braided with red ribbons.,A woman is dressed stylishly in native garb.
436,Oddly dressed man walking down the street.,An oddly dressed man walking.
437,A man in ruffles pushes a stroller through a park.,The man is pushing a stroller.
438,An oddly dressed man pushing a stroller down a sidewalk in a park.,A man wearing weird clothes is walking through a park.
439,A smiling man cooks something delicious.,The man is cooking
440,a young man wearing a backpack and sunglasses is walking towards a shopping area.,A man walks near a store
441,A young man wearing a backpack and dark glasses approaches the brick building where there is a bit of graffiti on the wall.,The young man has glasses on his face.
442,A brown dog running with two white and brown dogs on the seashore with crashing waves behind them.,The dogs were outdoors running along the shore
443,A young man in blue sunglasses walking in front of a red brick building.,Man in blue glasses walking pass a building
444,A dog jumps to catch a toy in the snow.,An animal is jumping in a place that is not hot.
445,Black dog jumping into the air to catch a toy in the snow.,The dog is in the snow.
446,A black dog in snow is jumping off the ground to catch a stick.,A dog is catching a stick.
447,A person is hanging up pictures of women with a few onlookers watching surrounded by bikes.,There are people watching another person hang up pictures.
448,"Five men, one wearing a white shirt standing on something, hanging up a picture of a child.",Men are hanging something on the wall.
449,There are four Eastern guys working on and hanging pictures of humans.,The men are working.
450,A man in a white shirt hangs a painting in a run down store while other men watch.,Men are indoors.
451,"Men are playing soccer, the one in front is about to kick the ball.",The guys are playing a game.
452,A man is putting up a poster in front of a shop.,A man is decorating a shop.
453,The Arsenal football club warms-up on the soccer field as a few fans watch.,A football/soccer club during warm ups.
454,Soccer players warm up by kicking the soccer ball around while the crowd waits.,The crowd looked on while the players prepared themselves.
455,People sit and relax next to a pool in a plaza.,People lounge about a pool.
456,"In a bowling alley, a man holding a green bowling ball looks ahead at the pins that he must knock down.",A man is bowling.
457,A man wearing blue jeans and red bowling shoes stands in a bowling alley lane with a green ball in his hand.,A man stands in a bowling alley lane.
458,"A guy stands with a green bowling ball in his hand, and looks down the bowling lane.",A man plays bowling.
459,A man holding a green bowling ball stands by the ball return machine in a bowling alley.,A person holding a green bowling ball stands by the ball return machine in a bowling alley.
460,A man is standing up holding a green bowling ball with his right hand.,A man is bowling.
461,A group of people sitting at a table outside talking.,A group sits outside while talking.
462,A group of men and women are having a discussion in a restaurant.,a group of men and women converse
463,A group of adults is having a discussion at a table under a tent.,People are having a discussion.
464,A group of people sitting around a picnic table.,The people are near the table.
465,"A group of people gathers on the grass in a backyard with tents, tables, and chairs set up.",A group of people gathering on the grass.
466,One soccer team is playing against another.,People are playing a sport.
467,A black dog swimming in water near rocks.,A dog is outside playing in the water.
468,the three boys are all holding onto a flotation device in the water.,Three boys are in a body of water.
469,A soccer game where the team in yellow is attempting to advance past the team in white towards the goalie wearing a black top and blue shorts.,There is a soccer game with a team in yellow.
470,A group of people are playing soccer and two players from opposing teams are battling for the ball.,A soccer game.
471,"A soccer match between a team with white jerseys, and a team with yellow jerseys.",A competition is happening.
472,A young woman is playing the violin.,The young violinist is a woman.
473,People relax around a large community fountain in a park.,Community members are spending time in the park near a foundtain.
474,A woman playing the violin with sunglasses on her head.,someone is playing an instrument
475,A female violinist surrounded by other violinists.,A violinist among other string musicians
476,"A man, wearing revolutionary period clothes, is ringing a bell.","A man, wearing a revolutionary apparel is making noise with a bell."
477,A couple of people working around a pile of rocks.,People are working.
478,A man wearing a gray cap is looking down.,A man is wearing a cap
479,An older man dressed in blue historical clothing is ringing a bell in his right hand.,man ringing a bell
480,"Three young children consisting of two girls and a boy who is holding an apple with a bite out of it, are posing on a scenic mountain view background.",A group of children are posing.
481,"two little girls, one in a green jacket and one in a pink jacket, and a little boy in a green jacket holding an apple sitting on a rock.",Three kids are sitting on a rock.
482,An old man wearing khaki pants and a brown shirt standing on the sidewalk in front of a building.,An old man is standing by a building in downtown.
483,A man in costume is ringing a bell.,A man is playing an instrument.
484,two female medical personnel read their charts.,The women work in the health field.
485,"A person in an orange shirt is laying on the ground while others are standing around her, smiling.",a person in orange
486,Two men stand around a mixing bowl.,Two men are around a bowl.
487,Five people on stage performing and acting while girl lay's on belly.,A groups of people acts on stage.
488,Four people are acting behind a woman in a yellow shirt is lying on the ground.,A woman is lying down.
489,"Two men cook together with a metal bowl, near a hanging plant.","Near a hanging plant, a metal bowl was used to cook by two mens"
490,a woman on a yellow shirt is on the floor.,A woman on top of her clothes.
491,Two men share a laugh while in the kitchen.,Two men are in the kitchen.
492,Two men are cooking in the kitchen using rice milk.,Two guys cook using some rice milk.
493,A man windsurfs in a wetsuit.,A man is windsurfing.
494,A kite surfer begins to fall in the ocean.,A kite surfer is falling
