,#1 String,#2 String
0,A person on a horse jumps over a broken down airplane.,"A person is outdoors, on a horse."
1,Children smiling and waving at camera,There are children present
2,A boy is jumping on skateboard in the middle of a red bridge.,The boy does a skateboarding trick.
3,Two blond women are hugging one another.,There are women showing affection.
4,"A few people in a restaurant setting, one of them is drinking orange juice.",The diners are at a restaurant.
5,An older man is drinking orange juice at a restaurant.,A man is drinking juice.
6,"A man with blond-hair, and a brown shirt drinking out of a public water fountain.",A blond man drinking water from a fountain.
7,Two women who just had lunch hugging and saying goodbye.,There are two woman in this picture.
8,"Two women, holding food carryout containers, hug.",Two women hug each other.
9,A Little League team tries to catch a runner sliding into a base in an afternoon game.,A team is trying to tag a runner out.
10,The school is having a special event in order to show the american culture on how other cultures are dealt with in parties.,A school is hosting an event.
11,High fashion ladies wait outside a tram beside a crowd of people in the city.,Women are waiting by a tram.
12,"A man, woman, and child enjoying themselves on a beach.",A family of three is at the beach.
13,A couple playing with a little boy on the beach.,A couple are playing with a young child outside.
14,A couple play in the tide with their young son.,The family is outside.
15,A man and a woman cross the street in front of a pizza and gyro restaurant.,"Near a couple of restaurants, two people walk across the street."
16,A woman in a green jacket and hood over her head looking towards a valley.,The woman is wearing green.
17,Woman in white in foreground and a man slightly behind walking with a sign for John's Pizza and Gyro in the background.,A woman in white.
18,"Two adults, one female in white, with shades and one male, gray clothes, walking across a street, away from a eatery with a blurred image of a dark colored red shirted person in the foreground.",The adults are both male and female.
19,"A woman wearing all white and eating, walks next to a man holding a briefcase.",A female is next to a man.
20,"A woman is walking across the street eating a banana, while a man is following with his briefcase.",the woman is outside
21,A skier slides along a metal rail.,A skier is near the rail.
22,A person on skis on a rail at night.,The person skiis
23,A skier in electric green on the edge of a ramp made of metal bars.,The brightly dressed skier slid down the race course.
24,A yellow uniformed skier is performing a trick across a railed object.,Somebody is engaging in winter sports.
25,A blond man is drinking from a public fountain.,The man is drinking water.
26,Wet brown dog swims towards camera.,A dog is in the water.
27,Closeup image of a dog swimming.,A dog swims in a body of water.
28,The furry brown dog is swimming in the ocean.,A dog is swimming.
29,A big brown dog swims towards the camera.,A dog swims towards the camera.
30,"A man wearing black with a gray hat, holding a pitchfork, directs a horse-drawn cart.",The man with the gray hat and pitchfork is directing the cart.
31,"A man is leading a Clydesdale up a hay road, within a Old Country.",A man is walking with his horse up a country road.
32,A farmer fertilizing his garden with manure with a horse and wagon.,The man is fertilizering his garden.
33,A white horse is pulling a cart while a man stands and watches.,An animal is walking outside.
34,A dog drops a red disc on a beach.,a dog drops a red disc
35,A man and a woman are walking on a street at the top of a hill.,A man and woman walk on a street.
36,An elderly man is drinking orange juice at a cafe.,An old man is enjoying a beverage at a cafe.
37,A couple holding hands walks down a street.,People are holding hands and walking.
38,A couple walk through a white brick town.,People are walking outdoors.
39,Children going home from school.,The school children head home.
40,People listening to a choir in a Catholic church.,Choir singing in mass.
41,Bicyclists waiting at an intersection.,Bikers stop and wait for traffic at the intersection.
42,People waiting at a light on bikes.,People are on their bikes.
43,People on bicycles waiting at an intersection.,There are people on bicycles.
44,A man with a red shirt is watching another man who is standing on top of a attached cart filled to the top.,The cart is filled to the top.
45,A boy is drinking out of a water fountain shaped like a woman.,A male is getting a drink of water.
46,three bikers stop in town.,Bikers stop for gas
47,Two people loading brush on a trailer attached to a truck.,A couple of people are loading brush onto a trailer that is attached to a truck.
48,"A man with a beard, wearing a red shirt with gray sleeves and work gloves, pulling on a rope.",A bearded man is pulling on a rope.
49,A man with facial hair and a red and gray shirt tugging on a piece of rope.,A man has facial hair.
50,A middle-aged oriental woman in a green headscarf and blue shirt is flashing a giant smile.,A middle aged oriental woman in a green headscarf and blue shirt is flashing a giant smile
51,An Asian woman in a blue top and green headscarf smiling widely as another woman rows a boat in the background.,An Asian woman is smiling at while another lady is rowing.
52,A boat worker securing line.,A worker is doing something to a boat.
53,A small girl with a necklace is swimming.,A small girl with a necklace is in the water
54,a skateboarder skates in the pool.,A skater is in the pool.
55,"A couple, who appear to be Indian or Pakistani, walk on a path beside a body of water, the mother carrying a child in a diaper, the father wrapped in a blanket with the logo of the humanitarian organization ""Save the Children.""",A couple carrying a child are walking along water.
56,"There is a woman holding a baby, along with a man with a save the children bag.",A group of people are possing for an add.
57,"A family with a baby, the father is wearing a save the children sign.",A man is wearing something with writing on it.
58,A foreign family is walking along a dirt path next to the water.,A foreign family walks by a dirt trail along a body of water.
59,"A man and a woman are standing next to sculptures, talking while another man looks at other sculptures.",A man and a woman are standing.
60,Group of young women in dresses strolling on the sidewalk.,there are some groups one of them of young females are in dresses strolling for a ramp walk
61,A man wearing a striped top and jeans does a skateboard trick on some steps while a man who is hunched over photographs him.,a man is photographing a man skateboarding.
62,A man squatting in the foreground of a photograph while taking a photograph of his own of a man doing a skateboarding kick flip in midair above a short flight of stairs outdoors.,A man is photographing another man.
63,One biker is running with their bike while another is riding around them.,People have bikes
64,"Two people with bicycles, one in front running with a bike and one in back riding.",One person running next to their bike with the person riding their bike behind them.
65,A young man doing a trick on a skateboard down the stairs while being photographed.,A man being photographed while he does a trick on his skateboard down the stairs.
66,"A lady in a black and white striped shirt and holding a bouquet of flowers, looks seriously at two gentlemen talking on the steps.",A lady with a serious face is standing with two guys in front of steps outside.
67,A man walking proudly down the street.,A man is outside.
68,Four teenage boys are doing cannonballs into a swimming pool.,A group of young men are splashing a lot of water.
69,Three men standing on grass by the water looking at something on a table.,The three men are outside.
70,A woman stands behind an outdoor grill with a blue basket of food in her hands.,A woman standing behind a grill outside with a blue basket of food in her hands.
71,A Land Rover makes its way through a deep pond.,A car drives through the water.
72,many people relax in the yard.,A group of people are outside.
73,A car sinking in water.,A car is flooding.
74,A man wearing black is playing an electric guitar at a concert.,A man is playing the guitar.
75,A man with wild hair rocks a show playing a guitar center stage.,A guy stands on stage with his guitar.
76,woman and child on trolley car labeled Powell and market and bay and taylor,The woman is on a trolley.
77,"Two female medical professionals, one african american& one white, looking over paperwork in a hospital.",There are people at work.
78,Two ladies are reading through binders.,Some women are reading.
79,A man in the distance is walking past a brick wall painted with words and graffiti.,Grafffiti on a brick wall.
80,A woman and a child holding on to the railing while on trolley.,The people are holding onto the rail.
81,A man in a striped polo shirt is pointing and smiling.,The man seems happy
82,A guy performing a bicycle jump trick for an audience.,a guy is performing a bike trick
83,A gray-haired woman in a blue dress coat with snowflakes on it balances something on her head.,The woman is wearing a coat.
84,Two children play outside in a field.,Kids are playing outdoors.
85,"One man sits inside and plays the banjo, there are trees behind him outside.",A male sitting indoors.
86,"Two children, in colorful outfits, playing in a field with a big rock in the middle.",Two kids are playing with a big rock in the field
87,Two young girls are playing outside in a non-urban environment.,Two girls are playing outside.
88,"Two children in hats play in an open, rocky field.",The children are playing in a rocky field.
89,A woman wearing a green and pink dress is dancing with someone wearing a blue top with white pants.,The woman in green and pink is dancing.
90,Man in gold pants looking at the camera.,Man looking at the camera.
91,A man in a gold skirt sits in front of the computer.,A man in a gold skirt sitting at his computer watching the computer screen.
92,Man wearing black t-shirt sitting at a computer desk.,the man is working on the computer
93,A bearded man in a black t-shirt sits in front of a desk holding a computer.,A man waiting with his computer.
94,"A man in a gold foils skirt, sitting at a computer desk, looks at the camera with his hands raised to his face.",a man is looking at his webcam
95,A young girl sitting at a table with a bowl on her head,A young girl has a bowl on her head
96,A man dances with a fire baton at night.,the man is dancing
97,A doctor checks the stomach of a toddler.,The toddler is getting a checkup.
98,Young blond woman putting her foot into a water fountain,A person is dipping her foot into water.
99,A young woman tries to stick her foot in a fountain.,The woman has one foot in the air.
100,A woman in capri jeans crouches on the edge of a fountain with her left foot kicked out to touch the falling water.,A woman is like to touch the water in fountain
101,Woman balancing on edge of fountain while sticking her toe in the water.,A woman stand on a fountain and dips her toes in.
102,A couple strolls arm and arm and hand in hand down a city sidewalk.,The couple is outdoors.
103,A man stare at a passing couple while walking down the block.,A man stares at a passing couple.
104,"a couple are holding hands behind their backs while walking down a street, and the man has his arm around her shoulder.",couple walking
105,A man and a woman are holding hands as they walk along a city sidewalk.,A man and a woman are holding hands.
106,New sport is being played to show appreciation to the kids who can not walk.,People are playing a sport in honor of crippled people.
107,Two men in wheelchairs are reaching in the air for a basketball.,Two people in wheelchairs are reaching in the air for a basketball.
108,Three wheelchair basketball players wearing team uniforms are attempting to reach the descending basketball with other players in the background.,Three wheelchair basketball players playing basketball in field.
109,Four guys in wheelchairs on a basketball court two are trying to grab a basketball in midair.,Four guys are playing basketball.
110,Three dogs in different shades of brown and white biting and licking each other.,there are three dogs
111,"Two dogs playfully bite a third dog, which has its tongue sticking out.",A pair of dogs tease a third with nibbles.
112,Three small puppies bite and play together in the grass.,Three puppies are playing outside.
113,Two dogs biting another dog in a field.,dogs attacking another dog
114,Tourists waiting at a train stop.,A group of tourist waiting for a train at a train station.
115,A doctor in blue scrubs is performing an operation assisted by two men and a woman.,a old man was talking
116,A woman with a black jacket walks past an outdoor movie poster.,A woman walking outside.
117,A man in an elf hat holding a white umbrella is standing on the sidewalk with two other men.,A man stands.
118,Indian lady and a guy in a blue suit dancing in the sunlight.,Two people dancing outdoors.
119,Two older men are talking.,Two people are having a conversation.
120,A mountain biker jumping a slope outdoors in a forest area.,They are avoiding trees.
121,Two older men in winter coats talking outside of a shop with a grassy lawn covered in a light coat of snow in front of it.,Two old men in winter coats talk outside.
122,"Two elderly men having a conversation, snow covered grass in the background.",There are two men outside in this picture
123,Two men are standing outside and snow is on the ground.,People are near snow.
124,Two older men in coats are standing outside.,They are outside wearing coats.
125,A gentleman in a purple scarf and hat is looking at money while holding an accordion.,A man is holding an accordian.
126,BMX biker jumps over a ravine.,there is a bmx biker who is perfect in ravine jumping
127,A white bike is tied to a street sign.,the bike is tied to a sign
128,A white bike is leaning against a post.,A bike it outside
129,The boy locked the cycle and went away.,A boy walking away.
130,A crowded city during daytime.,A city filled with people in the middle of the daytime.
131,People walking around in a big city.,People are outside.
132,A busy city that looks like New York City.,The city has a lot of people in it.
133,"A view of buildings and people walking across the streets in Times Square, New York City.",There is a city.
134,A woman is making a clay pot.,An artist is sculpting with clay.
135,A barber waiting for customers.,A barber is at work.
136,A man sitting in a barber shop.,There is an individual waiting indoors.
137,A woman preparing to glaze a bowl.,A woman preparing to glaze
138,"A woman wearing an apron inspects a large pot on a table filled with cups, bowls, pots and baskets of assorted size.",A woman is wearing an apron.
139,A model posing to look as if she's a real female soccer player.,A model is doing a shoot.
140,Firemen emerge from a subway station.,Firemen walking outside
141,Exhausted looking firemen are walking.,Firemen are walking.
142,"Three firefighters, the nearest firefighter is holding a helmet in his left hand.",The firemen are gathered one is holding his helmet.
143,A man walking along side a clean up crew.,The man walked alongside the crew.
144,A little boy swims underwater.,A child swimming.
145,A driver is racing his Ford vehicle on a gravel track.,A Ford is being driven on a track.
146,Three guys and a girl are all jumping in a pool together.,The people are all jumping into a body of water.
147,"A little boy underwater in a pool, holding a plastic dinosaur.",Small boy in pool holds toy.
148,A little boy swimming underwater with a toy in his hand.,A little boy is underwater.
149,A man wearing a white shire shirt and hate is riding a bucking horse in a rodeo.,A man is being bucked on a horse.
150,"A saddle bronc rider gets lifted out of the saddle, but keeps his grip during his ride.",The man rides an animal.
151,a woman with a straw hat working on a strange machine with coconuts at her side.,A woman is at a machine.
152,A man wearing a rice hat is shucking corn using a corn shucker and is surrounded by trees.,There is a person processing vegetables.
153,a woman wearing a Chinese straw hat operating some sort of stainless steel machine in what appears to be a park.,The woman is outdoors with a machine.
154,A woman on the side of a street is making food on her cart.,A person is cooking.
155,A man in blue shorts and without a shirt is jogging down the road while listening to his iPod.,The man is running.
156,Women exercising one woman has a green mat and black outfit on.,The women are exercising.
157,Students practicing yoga in a class setting.,A yoga class is in progress.
158,People are stretching on yoga mats.,The people stretched on yoga mats.
159,A group of people are doing yoga.,The people are doing yoga
160,Motorcyclist performing while two men watch.,Men watching motorcyclist.
161,The young man is waiting with others on the sidewalk.,there is a group of people waiting outside
162,Two people pose for the camera.,People pose for a picture.
163,A man is sleeping on the grass.,The man is laying down to sleep
164,A white and brown dog is leaping through the air.,The white and brown dog is in the air.
165,A row of legs and black boots with a boy sitting at the end of the row.,A boy sits at peoples feet.
166,A man in blue lies on a mostly-barren patch of grass while small groups of people congregate in the distance.,A man is wearing blue.
167,Various people hanging around outside of a building.,There are a group of people are standing outside.
168,A little girl follows two guys with umbrellas down a path.,The people are outside.
169,A lady is on the floor packing a suitcase.,She is packing.
170,Little girl in a blue and yellow plaid outfit and blue hat is running along the trail.,A girl is running on the trail.
171,"Little girl walking along a dirt, rock, and grass path wearing a blue hat many steps behind two people wearing backpacks and holding umbrellas.",3 people are walking along a path.
172,The blond woman is searching for medical supplies in a suitcase.,A blonde woman looks for things in a suitcase.
173,Stacks of neatly folded clothing cover most of this floor while a woman with a beige shirt and jeans busily fills a suitcase.,A woman is filling a suitcase.
174,A young woman packs belongings into a black suitcase.,A young woman packs belongings into a black luggage carrier.
175,People going for a long walk to the mountains.,The people are walking outdoors.
176,A man resting on a street.,A man resting on a street.
177,A woman in costume is marching with a large drum.,She plays in a band.
178,"A man carrying a load of fresh direct boxes on car with wheels in the city streets, as a woman walks towards him.",Someone is toting packages in an urban setting.
179,a motorcyclist does a nose wheelie.,A motorcyclist doing a wheelie
180,A man sitting on a scooter on the curb.,"A man is outside, near the street."
181,A man stopping on the sidewalk with his bike to have a smoke.,The man is standing.
182,A man is sitting on a motorcycle on the sidewalk.,A man is sitting on a motorcycle.
183,Man smokes while sitting on a parked scooter.,The man is smoking something while sitting on the scooter.
184,Man on the sidewalk sitting on a motorcycle.,Man sitting on a motorcycle on the sidewalk
185,"A couple, wearing black, burgundy, and white, dance.",The couple danced.
186,People in orange vests and blue pants with a yellow stripe at the bottom await the beginning of a race.,People in orange vests await the beginning of a race.
187,A young man and young lady dancing on a carpeted floor with a picture from the movie Toy Story on a big screen in the background.,The two people are dancing.
188,The skier is wearing a yellow jumpsuit and sliding across a yellow rail.,The skier is wearing a jumpsuit.
189,A track event held by J.P. Morgan Chase with security.,J.P. Morgan Chase held a track event.
190,"Two people dancing, wearing dance costumes.",The people are moving.
191,An english farmer with a horse pulled wagon.,There is a farmer with a horse wagon
192,Children's soccer game being played while the sun sets in the background.,Children playing soccer while the sun sets.
193,A soccer game played by a blue team and a red team on a perfectly manicured field at dusk.,People are playing soccer.
194,Two soccer teams are competing on a soccer field.,There is a soccer game.
195,Soccer teams play on a field as the sun sets behind a line of trees.,Soccer teams are competing outdoors.
196,two men serving preparing food.,Two men serving food.
197,A soccer game occurring at sunset.,a sports game is being played
198,White small child wearing a brown and gray striped hoodie plays at park.,A child plays at a park.
199,A little boy in brown pants is playing on ropes at a park.,There is a little boy in brown pants.
200,Toddler in striped sweatshirt plays on rope on playground.,A child plays on a playground.
201,A man in a blue shirt is looking up.,A person looks up.
202,Three girls on an amusement ride enjoying themselves.,There are three girls
203,Woman at Walmart check-out having her groceries bagged by an employee.,A woman is in Walmart
204,Brown dog treads through water.,Brown dog treads through water as he is soaked in water
205,A woman is waiting with children as she is checked out at Walmart.,A woman has children with her at the check out counter.
206,A blond woman with two children is checking out at a Walmart register.,A mother is with her two children at walmart
207,A woman sitting in a laundromat looking at the camera.,There is a woman in a room.
208,A young boy paddles across the water in a makeshift boat.,A boy is in a boat.
209,A baseball player is about to throw a baseball.,A baseball player is swinging to hit the ball.
210,A dog zips along the beach.,A dog is outside.
211,A white dog runs along a rocky shoreline.,A dog is running outside.
212,A fuzzy white lap dog runs along a rocky beach.,A dog runs across the beach.
213,A small white dog running on a pebble covered beach.,A dog on the beach.
214,A baseball player is putting all his might in to throwing a ball.,Pitcher is winding up a throw
215,Cheerleaders are on the field cheering.,Cheerleaders cheer on a field for an activity.
216,A woman holding a boombox.,A person holding a boombox.
217,A woman in a blue shirt and green hat looks up at the camera.,A woman wearing a blue shirt and green hat looks at the camera
218,Cheerleaders are doing a cheer at a football field.,The cheerleaders are wearing clothes.
219,"An excited, smiling woman stands at a red railing as she holds a boombox to one side.",A human standing.
220,A lady is kneeling wearing a blue shirt.,A lady is close to the floor.
221,The silhouette of three people in front of a wall.,The people are by the wall.
222,Two people wearing blue clothing are making hand gestures next to one another.,Two people are next to each other.
223,A spotted black and white dog splashes in the water.,the dog is in the water
224,"A large group, wearing pink shirts, waves to onlookers.",A crowd gesticulates.
225,A baby is playing with a strand of beads.,The baby is playing.
226,People are on a stage performing.,pwople are on stage
227,A woman is running a marathon in a park.,The woman is outdoors.
228,A group of people point forwards while performing some kind of act.,A group of people point forwards while doing something.
229,Several people are dancing together in sync.,people are dancing.
230,Group of people dancing,people dance together
231,An adult couple enjoys time in a hot tub.,A couple is in a hot tub.
232,An average looking man is playing the guitar.,The man knows how to play guitar.
233,Two tan and white dogs and one tan dog racing down the beach near the water.,three dogs are outside
234,A man and woman are walking down the street holding hands.,A couple of people are holding hands while walking.
235,A man is using his computer while seated at a desk.,A man sits at a desk.
236,A camera crew is filming two women in formal dresses sitting on a blanket in the middle of a park.,Someone is filming.
237,man sitting down playing a game of chess alone,A guy playing a board game by himself.
238,Young woman running as two guys in the back try to catch up to her.,group of people running
239,A man in a blue shirt sits outside alone with a chessboard laid out in front of him.,Someone sitting outside behind a chessboard.
240,A man dressed in blue shirt and shorts sits at a table while playing black in chess.,A man is playing a game
241,A young man in a blue blazer and shorts sits alone in front of table with a chess game set up.,A man sits in front of a set up chess game.
242,A young Asian man sits behind a set chessboard waiting for the other player to arrive.,A young man is sitting.
243,"Two young men drink beer, leaning on a graffitied wall.",The men are drinking.
244,A man being airlifted to safety after being in danger.,A man is being moved.
245,People in a meeting setting paying attention to a speaker in an orange shirt.,The people are listening to a speaker.
246,A meeting of young people sitting at a conference table.,young people are gathered around a table
247,A woman in a red shirt is speaking at a table in a room where three other people are listening to her.,the woman is wearing a red shirt.
248,A woman talks to two other women and a man with notepads in an office building with large windows.,a woman in an office building talks to two other women and a man with notepads
249,A classroom of students discussing lecture.,A classroom is discussing the topics of the day.
250,A man holds a clipboard and a pen as a woman looks at them.,A woman is looking at a man's possessions
